,tweet_id,timestamp,text,expanded_urls,rating_numerator,rating_denominator,name,doggo,floofer,pupper,puppo
987,749036806121881602,2016-07-02,This is Dietrich. He hops at random. Other doggos don't understand him. It upsets him greatly. 8/10 would comfort ,https://twitter.com/dog_rates/status/749036806121881602/photo/1,8,10,Dietrich,None,None,None,None
989,748932637671223296,2016-07-01,Say hello to Divine Doggo. Must be magical af. 13/10 would be an honor to pet ,https://twitter.com/dog_rates/status/748932637671223296/photo/1,13,10,Divine,doggo,None,None,None
991,748699167502000129,2016-07-01,Meet Tripp. He's being eaten by a sherk and doesn't even care. Unfazed af. 11/10 keep doin you Tripp ,"https://twitter.com/dog_rates/status/748699167502000129/photo/1,https://twitter.com/dog_rates/status/748699167502000129/photo/1",11,10,Tripp,None,None,None,None
994,748568946752774144,2016-06-30,This is Cora. She rings a bell for treats. 12/10 precious af (vid by @skyehellenkamp) ,https://twitter.com/dog_rates/status/748568946752774144/video/1,12,10,Cora,None,None,None,None
997,748324050481647620,2016-06-30,This is Duke. He permanently looks like he just tripped over something. 11/10 ,"https://twitter.com/dog_rates/status/748324050481647620/photo/1,https://twitter.com/dog_rates/status/748324050481647620/photo/1",11,10,Duke,None,None,None,None
1003,747844099428986880,2016-06-28,This is Huxley. He's pumped for #BarkWeek. Even has a hat. Ears are quite magical. 11/10 would remove hat to pat ,https://twitter.com/dog_rates/status/747844099428986880/photo/1,11,10,Huxley,None,None,None,None
1006,747648653817413632,2016-06-28,This is Keurig. He apparently headbutts other dogs to greet them. Not cool Keurig. So fluffy tho 12/10  ,https://vine.co/v/iqIZFtOxEMB,12,10,Keurig,None,None,None,None
1007,747600769478692864,2016-06-28,This is Bookstore and Seaweed. Bookstore is tired and Seaweed is an asshole. 10/10 and 7/10 respectively ,"https://twitter.com/dog_rates/status/747600769478692864/photo/1,https://twitter.com/dog_rates/status/747600769478692864/photo/1",10,10,Bookstore,None,None,None,None
1011,747439450712596480,2016-06-27,This is Linus. He just wanted to say hello but no one's paying attention. 12/10 (vid by @rebeccacollinzz) ,https://vine.co/v/5uTVXWvn3Ip,12,10,Linus,None,None,None,None
1013,747219827526344708,2016-06-27,This is Atticus. He's remaining calm but his costume looks terrified. 11/10 ,"https://twitter.com/dog_rates/status/747219827526344708/photo/1,https://twitter.com/dog_rates/status/747219827526344708/photo/1",11,10,Atticus,None,None,None,None
1014,747204161125646336,2016-06-26,This is Clark. He's deadly af. Clearly part shark (see pic 2). 10/10 would totally still try to pet ,"https://twitter.com/dog_rates/status/747204161125646336/photo/1,https://twitter.com/dog_rates/status/747204161125646336/photo/1",10,10,Clark,None,None,None,None
1020,746757706116112384,2016-06-25,This is Maddie. She gets some wicked air time. Hardcore barkour. 11/10 nimble af ,https://vine.co/v/5BYq6hmrEI3,11,10,Maddie,None,None,None,None
1021,746726898085036033,2016-06-25,Meet Abby. She's incredibly distracting. Just wants to help steer. Hazardous af. Still 12/10 would pet while driving ,https://twitter.com/dog_rates/status/746726898085036033/photo/1,12,10,Abby,None,None,None,None
1023,746521445350707200,2016-06-25,RT @dog_rates: This is Shaggy. He knows exactly how to solve the puzzle but can't talk. All he wants to do is help. 10/10 great guy ,https://twitter.com/dog_rates/status/667866724293877760/photo/1,10,10,Shaggy,None,None,None,None
1024,746507379341139972,2016-06-25,This is Shiloh. She did not pass the soft mouth egg test. 10/10 would absolutely still pet ,"https://twitter.com/dog_rates/status/746507379341139972/photo/1,https://twitter.com/dog_rates/status/746507379341139972/photo/1",10,10,Shiloh,None,None,None,None
1026,746131877086527488,2016-06-24,This is Gustav. He has claimed that plant. It is his now. 10/10 would not try to take his plant away ,https://twitter.com/dog_rates/status/746131877086527488/photo/1,10,10,Gustav,None,None,None,None
1027,746056683365994496,2016-06-23,This is Arlen and Thumpelina. They are best pals. Cuddly af. 11/10 for both puppers ,"https://twitter.com/dog_rates/status/746056683365994496/photo/1,https://twitter.com/dog_rates/status/746056683365994496/photo/1",11,10,Arlen,None,None,None,None
1028,745789745784041472,2016-06-23,This is Gus. He didn't win the Powerball. Quite perturbed about it. Still 10/10 would comfort in time of need ,https://twitter.com/dog_rates/status/745789745784041472/photo/1,10,10,Gus,None,None,None,None
1029,745712589599014916,2016-06-22,This is Percy. He fell asleep at the wheel. Irresponsible af. 7/10 absolute menace on the roadway ,https://twitter.com/dog_rates/status/745712589599014916/photo/1,7,10,Percy,None,None,None,None
1030,745433870967832576,2016-06-22,This is Lenox. She's in a wheelbarrow. Silly doggo. You don't belong there. 10/10 would push around ,"https://twitter.com/dog_rates/status/745433870967832576/photo/1,https://twitter.com/dog_rates/status/745433870967832576/photo/1,https://twitter.com/dog_rates/status/745433870967832576/photo/1",10,10,Lenox,doggo,None,None,None
1032,745314880350101504,2016-06-21,This is Sugar. She excels underwater. 12/10 photogenic af ,"https://twitter.com/dog_rates/status/745314880350101504/photo/1,https://twitter.com/dog_rates/status/745314880350101504/photo/1,https://twitter.com/dog_rates/status/745314880350101504/photo/1,https://twitter.com/dog_rates/status/745314880350101504/photo/1",12,10,Sugar,None,None,None,None
1033,745074613265149952,2016-06-21,This is Jeffrey. He wasn't prepared to execute such advanced barkour. Still 11/10 would totally pet ,https://vine.co/v/iQm3JAXuFmv,11,10,Jeffrey,None,None,None,None
1034,745057283344719872,2016-06-21,This is Oliver. He's downright gorgeous as hell. Should be on the cover of Dogue. 12/10 would introduce to mom ,"https://twitter.com/dog_rates/status/745057283344719872/photo/1,https://twitter.com/dog_rates/status/745057283344719872/photo/1",12,10,Oliver,None,None,None,None
1035,744995568523612160,2016-06-20,This is Abby. She got her face stuck in a glass. Churlish af. 9/10 rookie move puppo ,"https://twitter.com/dog_rates/status/744995568523612160/photo/1,https://twitter.com/dog_rates/status/744995568523612160/photo/1",9,10,Abby,None,None,None,puppo
1036,744971049620602880,2016-06-20,Say hello to Indie and Jupiter. They're having a stellar day out on the boat. Both 12/10 adorbz af ,"https://twitter.com/dog_rates/status/744971049620602880/photo/1,https://twitter.com/dog_rates/status/744971049620602880/photo/1,https://twitter.com/dog_rates/status/744971049620602880/photo/1",12,10,Indie,None,None,None,None
1037,744709971296780288,2016-06-20,This is Harvey. He's stealthy af. 10/10 would do my best to pet ,https://twitter.com/dog_rates/status/744709971296780288/photo/1,10,10,Harvey,None,None,None,None
1038,744334592493166593,2016-06-19,This is Blanket. She has overthrown her human. Demands walks like this every hour on the hour. 11/10 so damn fluffy ,https://twitter.com/dog_rates/status/744334592493166593/photo/1,11,10,Blanket,None,None,None,None
1041,743980027717509120,2016-06-18,This is Geno. He's a Wrinkled Baklavian Velveeta. Looks sad but that's just the extra skin. 11/10 would smoosh face ,https://twitter.com/dog_rates/status/743980027717509120/photo/1,11,10,Geno,None,None,None,None
1044,743609206067040256,2016-06-17,Meet Stark. He just had his first ice cream cone. Got some on his nose. Requests your assistance. 10/10 would assist ,"https://twitter.com/dog_rates/status/743609206067040256/photo/1,https://twitter.com/dog_rates/status/743609206067040256/photo/1,https://twitter.com/dog_rates/status/743609206067040256/photo/1",10,10,Stark,None,None,None,None
1045,743595368194129920,2016-06-17,This is Harold. He looks slippery af. Probably difficult to hug. Would still try tho. 7/10 great with kids I bet ,https://twitter.com/dog_rates/status/743595368194129920/photo/1,7,10,Harold,None,None,None,None
1046,743545585370791937,2016-06-16,Say hello to Bentley and Millie. They do everything together. Besties forever. Both 11/10 ,"https://twitter.com/dog_rates/status/743545585370791937/photo/1,https://twitter.com/dog_rates/status/743545585370791937/photo/1,https://twitter.com/dog_rates/status/743545585370791937/photo/1",11,10,Bentley,None,None,None,None
1047,743510151680958465,2016-06-16,"This is Beya. She doesn't want to swim, so she's not going to. 13/10 nonconforming af (vid by @HappyTailsResor) ",https://twitter.com/dog_rates/status/743510151680958465/video/1,13,10,Beya,None,None,None,None
1048,743253157753532416,2016-06-16,"This is Kilo. He cannot reach the snackum. Nifty tongue, but not nifty enough. 10/10 maybe one day puppo ",https://twitter.com/dog_rates/status/743253157753532416/photo/1,10,10,Kilo,None,None,None,puppo
1050,743210557239623680,2016-06-15,"Meet Kayla, an underground poker legend. Players lose on purpose hoping she'll let them pet her. 10/10 strategic af ",https://twitter.com/dog_rates/status/743210557239623680/photo/1,10,10,Kayla,None,None,None,None
1052,742528092657332225,2016-06-14,This is Maxaroni. He's pumped as hell for the summer. Been working on his beach bod for so long. 10/10 ,"https://twitter.com/dog_rates/status/742528092657332225/photo/1,https://twitter.com/dog_rates/status/742528092657332225/photo/1",10,10,Maxaroni,None,None,None,None
1054,742423170473463808,2016-06-13,This is Bell. She likes holding hands. 12/10 would definitely pet with other hand ,https://twitter.com/dog_rates/status/742423170473463808/photo/1,12,10,Bell,None,None,None,None
1055,742385895052087300,2016-06-13,This is Phil. That's his comfort stick. He holds onto it whenever he's sad. 11/10 don't be sad Phil ,https://twitter.com/dog_rates/status/742385895052087300/photo/1,11,10,Phil,None,None,None,None
1056,742161199639494656,2016-06-13,This is Doug. He's trying to float away. 12/10 you got this Doug ,https://twitter.com/dog_rates/status/742161199639494656/photo/1,12,10,Doug,None,None,None,None
1057,742150209887731712,2016-06-13,This is Edmund. He sends stellar selfies. Cute af. 8/10 would totally snapchat with this pupper ,https://twitter.com/dog_rates/status/742150209887731712/photo/1,8,10,Edmund,None,None,pupper,None
1059,741743634094141440,2016-06-11,Meet Aqua. She's a sandy pupper. Not sure how she feels about being so sandy. Radical tongue slip. 11/10 petable af ,"https://twitter.com/dog_rates/status/741743634094141440/photo/1,https://twitter.com/dog_rates/status/741743634094141440/photo/1,https://twitter.com/dog_rates/status/741743634094141440/photo/1",11,10,Aqua,None,None,pupper,None
1060,741438259667034112,2016-06-11,This is Tucker. He's still figuring out couches. 9/10 keep your head up pup ,https://twitter.com/dog_rates/status/741438259667034112/photo/1,9,10,Tucker,None,None,None,None
1061,741303864243200000,2016-06-10,This is Theodore. He just saw an adult wearing crocs. Did him a frighten. Lost other ear back in nam. 12/10 hero af ,https://twitter.com/dog_rates/status/741303864243200000/photo/1,12,10,Theodore,None,None,None,None
1062,741099773336379392,2016-06-10,This is Ted. He's given up. 11/10 relatable af ,https://vine.co/v/ixHYvdxUx1L,11,10,Ted,None,None,None,None
1064,740995100998766593,2016-06-09,This is Leo. He's a vape god. Blows o's for days. Probably drives a Subaru. Definitely owns multiple fedoras. 10/10 ,https://twitter.com/dog_rates/status/740995100998766593/photo/1,10,10,Leo,None,None,None,None
1066,740699697422163968,2016-06-09,This is Chip. He only mowed half the yard. 8/10 quit the shit Chip we have other things to do ,https://twitter.com/dog_rates/status/740699697422163968/photo/1,8,10,Chip,None,None,None,None
1067,740676976021798912,2016-06-08,"Meet Baloo. He's expecting a fast ground ball, hence the wide stance. Prepared af. 11/10 nothing runs like a pupper ",https://twitter.com/dog_rates/status/740676976021798912/photo/1,11,10,Baloo,None,None,pupper,None
1070,740359016048689152,2016-06-08,This is Chase. He's in a predicament. 9/10 help is on the way buddy ,https://twitter.com/dog_rates/status/740359016048689152/photo/1,9,10,Chase,None,None,None,None
1072,739979191639244800,2016-06-07,This is Nollie. She's waving at you. If you don't wave back you're a monster. She's also portable as hell. 12/10 ,https://twitter.com/dog_rates/status/739979191639244800/photo/1,12,10,Nollie,None,None,None,None
1073,739932936087216128,2016-06-06,Say hello to Rorie. She's zen af. Just enjoying a treat in the sunlight. 10/10 would immediately trade lives with ,https://twitter.com/dog_rates/status/739932936087216128/photo/1,10,10,Rorie,None,None,None,None
1074,739844404073074688,2016-06-06,This is Simba. He's the grand prize. The trophy is just for participation. 12/10 would pet so damn well ,https://twitter.com/dog_rates/status/739844404073074688/photo/1,12,10,Simba,None,None,None,None
1076,739606147276148736,2016-06-05,Meet Benji. He just turned 1. Has already given up on a traditional pupper physique. Just inhaled that thing. 9/10 ,"https://twitter.com/dog_rates/status/739606147276148736/photo/1,https://twitter.com/dog_rates/status/739606147276148736/photo/1,https://twitter.com/dog_rates/status/739606147276148736/photo/1",9,10,Benji,None,None,pupper,None
1078,739485634323156992,2016-06-05,This is Kyle. He's a heavy drinker and an avid pot user. Just wants to be pupular. 6/10 I can't support this Kyle ,"https://twitter.com/dog_rates/status/739485634323156992/photo/1,https://twitter.com/dog_rates/status/739485634323156992/photo/1",6,10,Kyle,None,None,None,None
1081,738885046782832640,2016-06-04,This is Charles. He's a Nova Scotian Towel Pouncer. Deadly af. Nifty tongue slip. 11/10 would pet with caution ,https://twitter.com/dog_rates/status/738885046782832640/photo/1,11,10,Charles,None,None,None,None
1083,738537504001953792,2016-06-03,This is Bayley. She fell asleep trying to escape her evil fence enclosure. 11/10 night night puppo ,"https://twitter.com/dog_rates/status/738537504001953792/photo/1,https://twitter.com/dog_rates/status/738537504001953792/photo/1",11,10,Bayley,None,None,None,puppo
1086,738166403467907072,2016-06-02,This is Axel. He's a professional leaf catcher. 12/10 gifted af ,"https://twitter.com/dog_rates/status/738166403467907072/photo/1,https://twitter.com/dog_rates/status/738166403467907072/photo/1,https://twitter.com/dog_rates/status/738166403467907072/photo/1,https://twitter.com/dog_rates/status/738166403467907072/photo/1",12,10,Axel,None,None,None,None
1087,738156290900254721,2016-06-01,This is Storkson. He's wet and sad. 10/10 cheer up pup ,https://twitter.com/dog_rates/status/738156290900254721/photo/1,10,10,Storkson,None,None,None,None
1088,737826014890496000,2016-06-01,This is Remy. He has some long ass ears (probably magical). Also very proud of broken stick. 10/10 such a good boy ,"https://twitter.com/dog_rates/status/737826014890496000/photo/1,https://twitter.com/dog_rates/status/737826014890496000/photo/1",10,10,Remy,None,None,None,None
1089,737800304142471168,2016-06-01,This is Bella. She's ubering home after a few too many drinks. 10/10 socially conscious af ,https://twitter.com/dog_rates/status/737800304142471168/photo/1,10,10,Bella,None,None,None,None
1092,737322739594330112,2016-05-30,Say hello to Lily. She's not injured or anything. Just wants everyone to hear her. 9/10 clever af ,https://twitter.com/dog_rates/status/737322739594330112/photo/1,9,10,Lily,None,None,None,None
1094,736736130620620800,2016-05-29,This is Chadrick. He's gnarly af 13/10 ,https://twitter.com/dog_rates/status/736736130620620800/photo/1,13,10,Chadrick,None,None,None,None
1096,736365877722001409,2016-05-28,This is Rory. He's extremely impatient. 11/10 settle down pupper ,"https://twitter.com/dog_rates/status/736365877722001409/photo/1,https://twitter.com/dog_rates/status/736365877722001409/photo/1,https://twitter.com/dog_rates/status/736365877722001409/photo/1,https://twitter.com/dog_rates/status/736365877722001409/photo/1",11,10,Rory,None,None,pupper,None
1099,735991953473572864,2016-05-27,This is Maxaroni. He's curly af. Also rather fabulous. 11/10 would hug well ,"https://twitter.com/dog_rates/status/735991953473572864/photo/1,https://twitter.com/dog_rates/status/735991953473572864/photo/1,https://twitter.com/dog_rates/status/735991953473572864/photo/1",11,10,Maxaroni,None,None,None,None
1101,735635087207878657,2016-05-26,This is Dakota. He hasn't grow into his skin yet. 11/10 would squeeze softly ,"https://twitter.com/dog_rates/status/735635087207878657/photo/1,https://twitter.com/dog_rates/status/735635087207878657/photo/1",11,10,Dakota,None,None,None,None
1103,735256018284875776,2016-05-24,This is Kellogg. He accidentally opened the front facing camera. 8/10 get it together doggo ,https://twitter.com/dog_rates/status/735256018284875776/photo/1,8,10,Kellogg,doggo,None,None,None
1104,735137028879360001,2016-05-24,Meet Buckley. His family &amp; some neighbors came over to watch him perform but he's nervous af. 9/10 u got this pupper ,https://twitter.com/dog_rates/status/735137028879360001/photo/1,9,10,Buckley,None,None,pupper,None
1105,734912297295085568,2016-05-24,This is Jax. He's a literal fluffball. Sneaky tongue slip. 10/10 would pet nonstop ,https://twitter.com/dog_rates/status/734912297295085568/photo/1,10,10,Jax,None,None,None,None
1107,734776360183431168,2016-05-23,This is Livvie. Someone should tell her it's been 47 years since Woodstock. Magical eyes tho 11/10 would stare into ,https://twitter.com/dog_rates/status/734776360183431168/photo/1,11,10,Livvie,None,None,None,None
1109,733828123016450049,2016-05-21,This is Terry. The harder you hug him the farther his tongue sticks out. 10/10 magical af ,"https://twitter.com/dog_rates/status/733828123016450049/photo/1,https://twitter.com/dog_rates/status/733828123016450049/photo/1",10,10,Terry,None,None,None,None
1110,733822306246479872,2016-05-21,This is Moose. He's a Polynesian Floofer. Dapper af. 10/10 would pet diligently ,https://twitter.com/dog_rates/status/733822306246479872/photo/1,10,10,Moose,None,floofer,None,None
1112,733460102733135873,2016-05-20,This is Hermione. Her face is as old as time. Appears fluffy af tho. 11/10 pretty damn majestic ,https://twitter.com/dog_rates/status/733460102733135873/photo/1,11,10,Hermione,None,None,None,None
1114,732732193018155009,2016-05-18,This is Ralpher. He's an East Guinean Flop Dog. Cuddly af. 12/10 ,https://twitter.com/dog_rates/status/732732193018155009/photo/1,12,10,Ralpher,None,None,None,None
1115,732726085725589504,2016-05-18,This is Aldrick. He looks wise af. Also exceptionally fluffy. Only two legs tho (unfortunate). 11/10 would still hug ,https://twitter.com/dog_rates/status/732726085725589504/photo/1,11,10,Aldrick,None,None,None,None
1117,732375214819057664,2016-05-17,This is Kyle (pronounced 'Mitch'). He strives to be the best doggo he can be. 11/10 would pat on head approvingly ,https://twitter.com/dog_rates/status/732375214819057664/photo/1,11,10,Kyle,doggo,None,None,None
1118,732005617171337216,2016-05-16,This is Larry. He has no self control. Tongue still nifty af tho 11/10 ,"https://twitter.com/dog_rates/status/732005617171337216/photo/1,https://twitter.com/dog_rates/status/732005617171337216/photo/1",11,10,Larry,None,None,None,None
1119,731285275100512256,2016-05-14,This is Solomon. He's a Beneroo Cumberflop. 12/10 would hug passionately ,https://twitter.com/dog_rates/status/731285275100512256/photo/1,12,10,Solomon,None,None,None,None
1122,730573383004487680,2016-05-12,This is Rooney. He can't comprehend glass. 10/10 it'll be ok pupper ,"https://twitter.com/dog_rates/status/730573383004487680/photo/1,https://twitter.com/dog_rates/status/730573383004487680/photo/1,https://twitter.com/dog_rates/status/730573383004487680/photo/1",10,10,Rooney,None,None,pupper,None
1123,730427201120833536,2016-05-11,This is Crystal. She's flawless. Really wants to be a frat bro. 11/10 who does she even know here? ,https://twitter.com/dog_rates/status/730427201120833536/photo/1,11,10,Crystal,None,None,None,None
1124,730211855403241472,2016-05-11,This is Ziva. She doesn't know how her collar works. 11/10 would totally fix for her ,https://twitter.com/dog_rates/status/730211855403241472/photo/1,11,10,Ziva,None,None,None,None
1125,730196704625098752,2016-05-11,This is Charles. He's camera shy. Tail longer than average. Doesn't look overwhelmingly fluffy. 6/10 would still pet ,https://twitter.com/dog_rates/status/730196704625098752/photo/1,6,10,Charles,None,None,None,None
1126,729854734790754305,2016-05-10,Say hello to Ollie. He conducts this train. He also greets you as you enter. Kind af. 11/10 would pet so firmly ,https://twitter.com/dog_rates/status/729854734790754305/photo/1,11,10,Ollie,None,None,None,None
1128,729823566028484608,2016-05-10,This is Stefan. He's a downright remarkable pup. 13/10 ,https://twitter.com/dog_rates/status/729823566028484608/photo/1,13,10,Stefan,None,None,None,None
1129,729463711119904772,2016-05-09,Meet Pupcasso. You can't afford his art. 13/10 talented af ,https://twitter.com/dog_rates/status/729463711119904772/photo/1,13,10,Pupcasso,None,None,None,None
1131,728986383096946689,2016-05-07,"This is Puff. He started out on the streets (first pic), but don't let the new smile fool you, still tough af. 11/10 ","https://twitter.com/dog_rates/status/728986383096946689/photo/1,https://twitter.com/dog_rates/status/728986383096946689/photo/1",11,10,Puff,None,None,None,None
1133,728751179681943552,2016-05-07,This is Flurpson. He can't believe it's not butter. 10/10 ,https://twitter.com/dog_rates/status/728751179681943552/photo/1,10,10,Flurpson,None,None,None,None
1134,728653952833728512,2016-05-06,This is Coleman. Somebody needs to tell him that he's sitting in chairs wrong. 8/10 ,"https://twitter.com/dog_rates/status/728653952833728512/photo/1,https://twitter.com/dog_rates/status/728653952833728512/photo/1,https://twitter.com/dog_rates/status/728653952833728512/photo/1",8,10,Coleman,None,None,None,None
1135,728409960103686147,2016-05-06,This is Wallace. He's a skater pup. He said see ya later pup. Can easily do a kick flip. Gnarly af. 10/10 v petable ,https://twitter.com/dog_rates/status/728409960103686147/photo/1,10,10,Wallace,None,None,None,None
1136,728387165835677696,2016-05-06,"This is Enchilada (yes, that's her real name). She's a Low-Cruisin Plopflopple. Very rare. Only a few left. 12/10 ",https://twitter.com/dog_rates/status/728387165835677696/photo/1,12,10,Enchilada,None,None,None,None
1137,728046963732717569,2016-05-05,This is Raymond. He controls fountains with his tongue. 11/10 pretty damn magical ,https://twitter.com/dog_rates/status/728046963732717569/photo/1,11,10,Raymond,None,None,None,None
1139,728015554473250816,2016-05-05,This is Rueben. He has reached ultimate pupper zen state. 11/10 tranquil af ,https://twitter.com/dog_rates/status/728015554473250816/photo/1,11,10,Rueben,None,None,pupper,None
1140,727685679342333952,2016-05-04,This is Cilantro. She's a Fellation Gadzooks. Eyes are super magical af. 12/10 could get lost in ,https://twitter.com/dog_rates/status/727685679342333952/photo/1,12,10,Cilantro,None,None,None,None
1145,727175381690781696,2016-05-02,This is Karll. He just wants to go kayaking. 10/10 please someone take Karll kayaking already ,"https://twitter.com/dog_rates/status/727175381690781696/photo/1,https://twitter.com/dog_rates/status/727175381690781696/photo/1",10,10,Karll,None,None,None,None
1147,726935089318363137,2016-05-02,This is Sprout. He's just precious af. 12/10 I'd do anything for Sprout ,"https://twitter.com/dog_rates/status/726935089318363137/photo/1,https://twitter.com/dog_rates/status/726935089318363137/photo/1,https://twitter.com/dog_rates/status/726935089318363137/photo/1,https://twitter.com/dog_rates/status/726935089318363137/photo/1",12,10,Sprout,None,None,None,None
1148,726887082820554753,2016-05-01,This is Blitz. He's a new dad struggling to cope mentally with the pressures of being a father. Sick shades 10/10 ,https://twitter.com/dog_rates/status/726887082820554753/photo/1,10,10,Blitz,None,None,None,None
1149,726828223124897792,2016-05-01,This is Bloop. He's a Phoenician Winnebago. Tongue is just wow. That box is all he has (tragic). 12/10 would caress ,https://twitter.com/dog_rates/status/726828223124897792/photo/1,12,10,Bloop,None,None,None,None
1151,725842289046749185,2016-04-29,This is Colby. He's currently regretting all those times he shook your hand for an extra treat. 12/10 ,https://twitter.com/dog_rates/status/725842289046749185/photo/1,12,10,Colby,None,None,None,None
1152,725786712245440512,2016-04-28,Say hello to Lillie. She's a Rutabagan Floofem. Poor pupper ate and then passed out. 11/10 relatable af ,https://twitter.com/dog_rates/status/725786712245440512/photo/1,11,10,Lillie,None,None,pupper,None
1153,725729321944506368,2016-04-28,This is Lola. She's a Butternut Splishnsplash. They are known to be ferocious af. 12/10 would absolutely still pet ,https://twitter.com/dog_rates/status/725729321944506368/photo/1,12,10,Lola,None,None,None,None
1155,724983749226668032,2016-04-26,This is Fred-Rick. He dabbles in parkour. The elevation gives him power. 12/10 hopefully visiting a mailbox near you ,https://twitter.com/dog_rates/status/724983749226668032/photo/1,12,10,Fred,None,None,None,None
1157,724405726123311104,2016-04-25,This is Ashleigh. She's having Coachella withdrawals. Didn't even go tho. 10/10 stay strong pupper ,https://twitter.com/dog_rates/status/724405726123311104/photo/1,10,10,Ashleigh,None,None,pupper,None
1158,724049859469295616,2016-04-24,This is Kreggory. He just took a look at his student debt. 10/10 can't even comprehend it ,https://twitter.com/dog_rates/status/724049859469295616/photo/1,10,10,Kreggory,None,None,None,None
