,tweet_id,timestamp,text,expanded_urls,rating_numerator,rating_denominator,name,doggo,floofer,pupper,puppo
1478,693590843962331137,2016-01-31,Meet Phil. He's big af. Currently destroying this nice family home. Completely uncalled for. 3/10 not a good pupper ,https://twitter.com/dog_rates/status/693590843962331137/photo/1,3,10,Phil,None,None,pupper,None
1480,693486665285931008,2016-01-30,This is Lincoln. He doesn't understand his new jacket. 11/10 please enjoy (vid by @GraceIsTheName8) ,https://twitter.com/dog_rates/status/693486665285931008/video/1,11,10,Lincoln,None,None,None,None
1481,693280720173801472,2016-01-30,This is Sadie and her 2 pups Shebang &amp; Ruffalo. Sadie says single parenting is challenging but rewarding. All 10/10 ,https://twitter.com/dog_rates/status/693280720173801472/photo/1,10,10,Sadie,None,None,None,None
1482,693267061318012928,2016-01-30,This is Oscar. He can wave. Friendly af. 12/10 would totally wave back (IG: Oscar.is.bear) ,https://vine.co/v/i5n2irFUYWv,12,10,Oscar,None,None,None,None
1484,693231807727280129,2016-01-30,"This is Bodie. He's not proud of what he did, but it needed to be done. 9/10 eight days was a pretty good streak tbh ",https://twitter.com/dog_rates/status/693231807727280129/photo/1,9,10,Bodie,None,None,None,None
1485,693155686491000832,2016-01-29,This is Dunkin. He can only see when he's wet (tragic). 12/10 future heartbreaker ,"https://twitter.com/dog_rates/status/693155686491000832/photo/1,https://twitter.com/dog_rates/status/693155686491000832/photo/1,https://twitter.com/dog_rates/status/693155686491000832/photo/1,https://twitter.com/dog_rates/status/693155686491000832/photo/1",12,10,Dunkin,None,None,None,None
1487,693095443459342336,2016-01-29,This is Milo. He doesn't understand your fancy human gestures. Will lick instead. 10/10 can't faze this pupper ,https://twitter.com/dog_rates/status/693095443459342336/photo/1,10,10,Milo,None,None,pupper,None
1489,692905862751522816,2016-01-29,This is Wally. He's being abducted by aliens. 10/10 poor pupper ,https://twitter.com/dog_rates/status/692905862751522816/photo/1,10,10,Wally,None,None,pupper,None
1491,692894228850999298,2016-01-29,Meet Tupawc. He's actually a Christian rapper. Doesn't even understand the concept of dollar signs. 10/10 great guy ,https://twitter.com/dog_rates/status/692894228850999298/photo/1,10,10,Tupawc,None,None,None,None
1494,692568918515392513,2016-01-28,This is Chester. He's been guarding this pumpkin since October. Dedicated af. Hat is nifty as hell. 12/10 would snug ,"https://twitter.com/dog_rates/status/692568918515392513/photo/1,https://twitter.com/dog_rates/status/692568918515392513/photo/1,https://twitter.com/dog_rates/status/692568918515392513/photo/1",12,10,Chester,None,None,None,None
1495,692535307825213440,2016-01-28,This is Amber. She's a Fetty Woof. 10/10 would pet in a heartbeat ,https://twitter.com/dog_rates/status/692535307825213440/photo/1,10,10,Amber,None,None,None,None
1496,692530551048294401,2016-01-28,Say hello to Cody. He's been to like 80 countries and is way more cultured than you. He wanted me to say that. 10/10 ,https://twitter.com/dog_rates/status/692530551048294401/photo/1,10,10,Cody,None,None,None,None
1498,692417313023332352,2016-01-27,Meet Herschel. He's slightly bigger than ur average pupper. Looks lonely. Could probably ride 7/10 would totally pet ,https://twitter.com/dog_rates/status/692417313023332352/photo/1,7,10,Herschel,None,None,pupper,None
1500,692158366030913536,2016-01-27,This is Edgar. He's a Sassafras Puggleflash. Nothing satisfies him. Not since the war. 10/10 cheer up pup ,https://twitter.com/dog_rates/status/692158366030913536/photo/1,10,10,Edgar,None,None,None,None
1502,692041934689402880,2016-01-26,This is Teddy. His head is too heavy. 13/10 (vid by @jooanrim) ,https://vine.co/v/iiI3wmqXYmA,13,10,Teddy,None,None,None,None
1503,692017291282812928,2016-01-26,This is Kingsley Wellensworth III. He owns 7 range rovers. Has a cardigan collection. Would rather be sailing. 9/10 ,https://twitter.com/dog_rates/status/692017291282812928/photo/1,9,10,Kingsley,None,None,None,None
1504,691820333922455552,2016-01-26,This is Brockly. He's an uber driver. Falls asleep at the wheel often. Irresponsible af 8/10 would totally still pet ,https://twitter.com/dog_rates/status/691820333922455552/photo/1,8,10,Brockly,None,None,None,None
1507,691675652215414786,2016-01-25,This is Richie and Plip. They are the best of pals. Do everything together. 10/10 for both ,https://twitter.com/dog_rates/status/691675652215414786/photo/1,10,10,Richie,None,None,None,None
1509,691459709405118465,2016-01-25,Say hello to Leo. He's a Fallopian Puffalope. Precious af. 12/10 would cuddle ,"https://twitter.com/dog_rates/status/691459709405118465/photo/1,https://twitter.com/dog_rates/status/691459709405118465/photo/1",12,10,Leo,None,None,None,None
1510,691444869282295808,2016-01-25,This is Bailey. She likes flowers. 12/10 ,"https://twitter.com/dog_rates/status/691444869282295808/photo/1,https://twitter.com/dog_rates/status/691444869282295808/photo/1",12,10,Bailey,None,None,None,None
1512,691321916024623104,2016-01-24,This is Molly. She's a Peruvian Niddlewog. Loves her new hat. 11/10 would totally pet ,https://twitter.com/dog_rates/status/691321916024623104/photo/1,11,10,Molly,None,None,None,None
1518,690932576555528194,2016-01-23,This is Buddy. He's testing out the water. Such caution. Much reserve. 12/10 ,https://twitter.com/dog_rates/status/690932576555528194/photo/1,12,10,Buddy,None,None,None,None
1519,690735892932222976,2016-01-23,Say hello to Peaches. She's a Dingleberry Zanderfloof. 13/10 would caress lots ,"https://twitter.com/dog_rates/status/690735892932222976/photo/1,https://twitter.com/dog_rates/status/690735892932222976/photo/1",13,10,Peaches,None,None,None,None
1520,690728923253055490,2016-01-23,This is Vinscent. He was just questioned about his recent credit card spending. 8/10 ,https://twitter.com/dog_rates/status/690728923253055490/photo/1,8,10,Vinscent,None,None,None,None
1521,690690673629138944,2016-01-23,This is Cedrick. He's a spookster. Did me a discomfort. 10/10 would pet with a purpose ,https://twitter.com/dog_rates/status/690690673629138944/photo/1,10,10,Cedrick,None,None,None,None
1522,690649993829576704,2016-01-22,This is Hazel. She's a gymnast. Training hard for Rio. 11/10 focused af ,https://twitter.com/dog_rates/status/690649993829576704/photo/1,11,10,Hazel,None,None,None,None
1524,690597161306841088,2016-01-22,This is Lolo. She's America af. Behind in science &amp; math but can say whatever she wants on Twitter. 11/10 ...Merica ,https://twitter.com/dog_rates/status/690597161306841088/photo/1,11,10,Lolo,None,None,None,None
1525,690400367696297985,2016-01-22,"This is Eriq. His friend just reminded him of last year's super bowl. Not cool friend
10/10 for Eriq
6/10 for friend ",https://twitter.com/dog_rates/status/690400367696297985/photo/1,10,10,Eriq,None,None,None,None
1526,690374419777196032,2016-01-22,This is Phred. He's an Albanian Flepperkush. Tongue is rather impressive if I'm honest. Perhaps even legendary 11/10 ,https://twitter.com/dog_rates/status/690374419777196032/photo/1,11,10,Phred,None,None,None,None
1528,690348396616552449,2016-01-22,This is Oddie. He's trying to communicate. 12/10 very solid effort (vid by @kaleseyy) ,https://vine.co/v/iejBWerY9X2,12,10,Oddie,None,None,None,None
1529,690248561355657216,2016-01-21,This is Maxwell. That's his moped. He rents it out for others to use as long as he can come also. 11/10 great dog ,https://twitter.com/dog_rates/status/690248561355657216/photo/1,11,10,Maxwell,None,None,None,None
1530,690021994562220032,2016-01-21,"Say hello to Geoff (pronounced ""Kyle""). He accidentally opened the front facing camera. 10/10 ",https://twitter.com/dog_rates/status/690021994562220032/photo/1,10,10,Geoff,None,None,None,None
1533,689999384604450816,2016-01-21,This is Covach. He's trying to melt the snow. 10/10 we all believe in you buddy ,https://twitter.com/dog_rates/status/689999384604450816/photo/1,10,10,Covach,None,None,None,None
1536,689905486972461056,2016-01-20,"Say hello to Gizmo. He's quite the pupper. Confused by bed, but agile af. Can barely catch on camera. 11/10 so quick ","https://twitter.com/dog_rates/status/689905486972461056/photo/1,https://twitter.com/dog_rates/status/689905486972461056/photo/1,https://twitter.com/dog_rates/status/689905486972461056/photo/1,https://twitter.com/dog_rates/status/689905486972461056/photo/1",11,10,Gizmo,None,None,pupper,None
1537,689877686181715968,2016-01-20,This is Durg. He's trying to conquer his fear of trampolines. 9/10 it's not working ,https://twitter.com/dog_rates/status/689877686181715968/photo/1,9,10,Durg,None,None,None,None
1538,689835978131935233,2016-01-20,Meet Fynn &amp; Taco. Fynn is an all-powerful leaf lord and Taco is in the wrong place at the wrong time. 11/10 &amp; 10/10 ,https://twitter.com/dog_rates/status/689835978131935233/photo/1,11,10,Fynn,None,None,None,None
1539,689661964914655233,2016-01-20,Meet Luca. He's a Butternut Scooperfloof. Glorious tongue. 12/10 would pet really well ,https://twitter.com/dog_rates/status/689661964914655233/photo/1,12,10,Luca,None,None,None,None
1540,689659372465688576,2016-01-20,This is Ricky. He's being escorted out of the dog park for talking shit about the other dogs. 8/10 not cool Ricky ,https://twitter.com/dog_rates/status/689659372465688576/photo/1,8,10,Ricky,None,None,None,None
1541,689623661272240129,2016-01-20,This is Lucy. She's terrified of the stuffed billed dog. 10/10 stay strong pupper ,"https://twitter.com/dog_rates/status/689623661272240129/photo/1,https://twitter.com/dog_rates/status/689623661272240129/photo/1",10,10,Lucy,None,None,pupper,None
1544,689517482558820352,2016-01-19,This is Carl. He just wants to make sure you're having a good day. 12/10 just a swell pup ,"https://twitter.com/dog_rates/status/689517482558820352/photo/1,https://twitter.com/dog_rates/status/689517482558820352/photo/1,https://twitter.com/dog_rates/status/689517482558820352/photo/1",12,10,Carl,None,None,None,None
1546,689283819090870273,2016-01-19,Say hello to Chipson. He's aerodynamic af. No eyes (devastating). 9/10 would make sure he didn't bump into stuff ,https://twitter.com/dog_rates/status/689283819090870273/photo/1,9,10,Chipson,None,None,None,None
1547,689280876073582592,2016-01-19,This is Herald. He wants you to know he could steal your girl at any moment. 10/10 ,"https://twitter.com/dog_rates/status/689280876073582592/photo/1,https://twitter.com/dog_rates/status/689280876073582592/photo/1,https://twitter.com/dog_rates/status/689280876073582592/photo/1,https://twitter.com/dog_rates/status/689280876073582592/photo/1",10,10,Herald,None,None,None,None
1548,689275259254616065,2016-01-19,Meet Lucky. He was showing his friends an extreme pogo stick trick when he completely lost control. 10/10 still rad ,https://twitter.com/dog_rates/status/689275259254616065/photo/1,10,10,Lucky,None,None,None,None
1549,689255633275777024,2016-01-19,This is Ferg. He swallowed a chainsaw. 1 like = 1 prayer 10/10 remain calm Ferg (vid by @calebturer) ,https://vine.co/v/iOL792n5hz2,10,10,Ferg,None,None,None,None
1551,689143371370250240,2016-01-18,Meet Trip. He likes wearing costumes that aren't consistent with the season to screw with people 10/10 tricky pupper ,https://twitter.com/dog_rates/status/689143371370250240/photo/1,10,10,Trip,None,None,pupper,None
1553,688908934925697024,2016-01-18,Meet Clarence. He does parkour. 8/10 very talented dog ,https://twitter.com/dog_rates/status/688908934925697024/photo/1,8,10,Clarence,None,None,None,None
1555,688894073864884227,2016-01-18,This is Hamrick. He's covered in corn flakes. Silly pupper. Looks congested. 7/10 considerably petable ,https://twitter.com/dog_rates/status/688894073864884227/photo/1,7,10,Hamrick,None,None,pupper,None
1556,688828561667567616,2016-01-17,Say hello to Brad. His car probably has a spoiler. Tan year round. Likes your insta pic but doesn't text back. 9/10 ,https://twitter.com/dog_rates/status/688828561667567616/photo/1,9,10,Brad,None,None,None,None
1558,688789766343622656,2016-01-17,Meet Pubert. He's a Kerplunk Rumplestilt. Cannot comprehend flower. Flawless tongue. 8/10 would pat head approvingly ,https://twitter.com/dog_rates/status/688789766343622656/photo/1,8,10,Pubert,None,None,None,None
1559,688547210804498433,2016-01-17,This is Frönq. He got caught stealing a waffle. Damn it Frönq. 9/10 ,https://twitter.com/dog_rates/status/688547210804498433/photo/1,9,10,Frönq,None,None,None,None
1561,688385280030670848,2016-01-16,This is Louis. He's takes top-notch selfies. 12/10 would snapchat with ,"https://twitter.com/dog_rates/status/688385280030670848/photo/1,https://twitter.com/dog_rates/status/688385280030670848/photo/1,https://twitter.com/dog_rates/status/688385280030670848/photo/1,https://twitter.com/dog_rates/status/688385280030670848/photo/1",12,10,Louis,None,None,None,None
1562,688211956440801280,2016-01-16,This is Derby. He's a superstar. 13/10 (vid by @NBohlmann) ,https://twitter.com/dog_rates/status/688211956440801280/video/1,13,10,Derby,None,None,None,None
1563,688179443353796608,2016-01-16,This is Lizzie. She's about to fist bump the large ridable maned pupper. She's very excited. 10/10 for both dogs ,https://twitter.com/dog_rates/status/688179443353796608/photo/1,10,10,Lizzie,None,None,pupper,None
1565,688064179421470721,2016-01-15,This is Kilo. He's a Pouncing Brioche. Really likes snow. 11/10 ,https://twitter.com/dog_rates/status/688064179421470721/photo/1,11,10,Kilo,None,None,None,None
1567,687826841265172480,2016-01-15,This is Louis. He's a rollercoaster of emotions. Incalculably fluffy. 12/10 would pet firmly ,"https://twitter.com/dog_rates/status/687826841265172480/photo/1,https://twitter.com/dog_rates/status/687826841265172480/photo/1,https://twitter.com/dog_rates/status/687826841265172480/photo/1,https://twitter.com/dog_rates/status/687826841265172480/photo/1",12,10,Louis,None,None,None,None
1569,687807801670897665,2016-01-15,Meet Trooper &amp; Maya. Trooper protects Maya from bad things like dognappers and Comcast. So touching. 11/10 for both ,https://twitter.com/dog_rates/status/687807801670897665/photo/1,11,10,Trooper,None,None,None,None
1570,687732144991551489,2016-01-14,This is Ember. That's the q-tip she owes money to. 11/10 pay up pup. (vid by @leanda_h) ,https://vine.co/v/iOuMphL5DBY,11,10,Ember,None,None,None,None
1571,687704180304273409,2016-01-14,Say hello to Blakely. He thinks that's a hat. Silly pupper. That's a nanner. 9/10 ,https://twitter.com/dog_rates/status/687704180304273409/photo/1,9,10,Blakely,None,None,pupper,None
1572,687664829264453632,2016-01-14,Meet Opal. He's a Belgian Dijon Poofster. Upset because his hood makes him look like blond Justin Timberlake. 11/10 ,https://twitter.com/dog_rates/status/687664829264453632/photo/1,11,10,Opal,None,None,None,None
1573,687494652870668288,2016-01-14,This is Marq. He stole this car. 7/10 wtf Marq? ,https://twitter.com/dog_rates/status/687494652870668288/photo/1,7,10,Marq,None,None,None,None
1575,687476254459715584,2016-01-14,This is Curtis. He's a fluffball. 11/10 would snug this pupper ,https://twitter.com/dog_rates/status/687476254459715584/photo/1,11,10,Curtis,None,None,pupper,None
1576,687460506001633280,2016-01-14,This is Kramer. He's a Picasso Tortellini. Tie couldn't be more accurate. Confident af. Runs his own business. 10/10 ,https://twitter.com/dog_rates/status/687460506001633280/photo/1,10,10,Kramer,None,None,None,None
1577,687399393394311168,2016-01-13,This is Barry. He's very fast. I hope he finds what he's looking for. 10/10 (vid by @KeeganWolfe33) ,https://vine.co/v/iM2hLu9LU5i,10,10,Barry,None,None,None,None
1578,687317306314240000,2016-01-13,This is Tyrone. He's a leaf wizard. Self-motivated. No eyes (tragic). Inspirational af. 11/10 enthusiasm is tangible ,"https://twitter.com/dog_rates/status/687317306314240000/photo/1,https://twitter.com/dog_rates/status/687317306314240000/photo/1",11,10,Tyrone,None,None,None,None
1580,687127927494963200,2016-01-13,Meet Gordon. He's an asshole. 9/10 would still pet ,https://twitter.com/dog_rates/status/687127927494963200/photo/1,9,10,Gordon,None,None,None,None
1581,687124485711986689,2016-01-13,Say hello to Samson. He's a Firecracker Häagen-Dazs. 11/10 objects in mirror may be more petable than they appear ,https://twitter.com/dog_rates/status/687124485711986689/photo/1,11,10,Samson,None,None,None,None
1582,687109925361856513,2016-01-13,This is Baxter. He looks like a fun dog. Prefers action shots. 11/10 the last one is impeccable ,"https://twitter.com/dog_rates/status/687109925361856513/photo/1,https://twitter.com/dog_rates/status/687109925361856513/photo/1,https://twitter.com/dog_rates/status/687109925361856513/photo/1",11,10,Baxter,None,None,None,None
1585,686947101016735744,2016-01-12,This is Jackson. He was specifically told not to sleep in the fridge. Damn it Jackson. 11/10 would squeeze softly ,https://twitter.com/dog_rates/status/686947101016735744/photo/1,11,10,Jackson,None,None,None,None
1589,686683045143953408,2016-01-11,This is Mona. She's a Yarborough Splishnsplash. Lost body during Nam. 11/10 revolutionary pupper ,https://twitter.com/dog_rates/status/686683045143953408/photo/1,11,10,Mona,None,None,pupper,None
1590,686618349602762752,2016-01-11,This is Olivia. She just saw an adult wearing crocs. 11/10 poor pupper. No one should witness such a thing ,https://twitter.com/dog_rates/status/686618349602762752/photo/1,11,10,Olivia,None,None,pupper,None
1591,686606069955735556,2016-01-11,"Meet Horace. He was practicing his levitation, minding his own business when a rogue tennis ball spooked him. 10/10 ",https://twitter.com/dog_rates/status/686606069955735556/photo/1,10,10,Horace,None,None,None,None
1593,686386521809772549,2016-01-11,Say hello to Crimson. He's a Speckled Winnebago. Main passions are air hockey &amp; parkour. 11/10 would pet thoroughly ,https://twitter.com/dog_rates/status/686386521809772549/photo/1,11,10,Crimson,None,None,None,None
1594,686377065986265092,2016-01-11,Meet Birf. He thinks he's gone blind. 10/10 very frightened pupper ,https://twitter.com/dog_rates/status/686377065986265092/photo/1,10,10,Birf,None,None,pupper,None
1597,686050296934563840,2016-01-10,This is Flávio. He's a Macedonian Poppycock. 97% floof. Jubilant af. 11/10 personally I'd pet the hell out of ,https://twitter.com/dog_rates/status/686050296934563840/photo/1,11,10,Flávio,None,None,None,None
1601,686003207160610816,2016-01-10,This is Hammond. He's a peculiar pup. Loves long walks. Bark barely audible. Too many legs. 3/10 must be rare ,https://twitter.com/dog_rates/status/686003207160610816/photo/1,3,10,Hammond,None,None,None,None
1602,685973236358713344,2016-01-09,This is Lorelei. She's contemplating her existence and the eventual heat death of the universe. 11/10 very majestic ,https://twitter.com/dog_rates/status/685973236358713344/photo/1,11,10,Lorelei,None,None,None,None
1604,685906723014619143,2016-01-09,This is Olive. He's stuck in a sleeve. 9/10 damn it Olive ,"https://twitter.com/dog_rates/status/685906723014619143/photo/1,https://twitter.com/dog_rates/status/685906723014619143/photo/1",9,10,Olive,None,None,None,None
1606,685667379192414208,2016-01-09,This is Marty. He has no idea what happened here. Never seen this stuff in his life. 9/10 very suspicious pupper ,https://twitter.com/dog_rates/status/685667379192414208/photo/1,9,10,Marty,None,None,pupper,None
1607,685663452032069632,2016-01-09,"Meet Brooks. He's confused by the almighty ball of tennis. 12/10 

(vid by @PDolan37) ",https://twitter.com/dog_rates/status/685663452032069632/video/1,12,10,Brooks,None,None,None,None
1608,685641971164143616,2016-01-09,This is Otis. He just passed a cop while going 61 in a 45. Very nervous pupper. 7/10 ,https://twitter.com/dog_rates/status/685641971164143616/photo/1,7,10,Otis,None,None,pupper,None
1612,685321586178670592,2016-01-08,This is Rocky. He sleeps like a psychopath. 10/10 quality tongue slip ,https://twitter.com/dog_rates/status/685321586178670592/photo/1,10,10,Rocky,None,None,None,None
1614,685307451701334016,2016-01-08,Say hello to Petrick. He's an Altostratus Floofer. Just had a run in with a trash bag. Groovy checkered floor. 11/10 ,https://twitter.com/dog_rates/status/685307451701334016/photo/1,11,10,Petrick,None,floofer,None,None
1615,685268753634967552,2016-01-08,This is Hubertson. He's a Carmel Haberdashery. Enjoys long summer days on his boat. Very peaceful pupper. 10/10 ,https://twitter.com/dog_rates/status/685268753634967552/photo/1,10,10,Hubertson,None,None,pupper,None
1616,685198997565345792,2016-01-07,This is Alfie. That is his time machine. He's very proud of it. Without him life as we know it would not exist 11/10 ,https://twitter.com/dog_rates/status/685198997565345792/photo/1,11,10,Alfie,None,None,None,None
1617,685169283572338688,2016-01-07,Meet Gerbald. He just found out he's adopted. Poor pupper. Snazzy tongue tho. 11/10 would hold close in time of need ,https://twitter.com/dog_rates/status/685169283572338688/photo/1,11,10,Gerbald,None,None,pupper,None
1619,684959798585110529,2016-01-07,This is Jerry. He's a neat dog. No legs (tragic). Has more horns than a dog usually does. Bark is unique af. 5/10 ,https://twitter.com/dog_rates/status/684959798585110529/photo/1,5,10,Jerry,None,None,None,None
1620,684940049151070208,2016-01-07,This is Oreo. She's a photographer and a model. Living a double pupple life. 12/10 such talent much cute would pet ,"https://twitter.com/dog_rates/status/684940049151070208/photo/1,https://twitter.com/dog_rates/status/684940049151070208/photo/1",12,10,Oreo,None,None,None,None
1621,684926975086034944,2016-01-07,Meet Bruiser &amp; Charlie. They are the best of pals. Been through it all together. Both 11/10. 1 like=1 friendship ,https://twitter.com/dog_rates/status/684926975086034944/photo/1,11,10,Bruiser,None,None,None,None
1623,684902183876321280,2016-01-07,This is Perry. He's an Augustus Gloopster. Very condescending. Makes up for it with the sneaky tongue slip. 11/10 ,https://twitter.com/dog_rates/status/684902183876321280/photo/1,11,10,Perry,None,None,None,None
1626,684800227459624960,2016-01-06,Meet Theodore. He's dapper as hell. Probably owns horses. Uses 'summer' as a verb. Often quotes philosophers. 11/10 ,https://twitter.com/dog_rates/status/684800227459624960/photo/1,11,10,Theodore,None,None,None,None
1629,684567543613382656,2016-01-06,This is Bobby. He doesn't give a damn about personal space. Convinced he called shotgun first. 4/10 not the best dog ,https://twitter.com/dog_rates/status/684567543613382656/photo/1,4,10,Bobby,None,None,None,None
1631,684481074559381504,2016-01-05,Meet Pippa. She's an Elfin High Feta. Compact af. Easy to transport. Great for vacations. 10/10 would keep in pocket ,https://twitter.com/dog_rates/status/684481074559381504/photo/1,10,10,Pippa,None,None,None,None
1632,684460069371654144,2016-01-05,This is Jeph. He's a Western Sagittarius Dookmarriot. Frightened by leaf. Caught him off guard. 10/10 calm down Jeph ,https://twitter.com/dog_rates/status/684460069371654144/photo/1,10,10,Jeph,None,None,None,None
1633,684241637099323392,2016-01-05,This is Obi. He got camera shy. 12/10 ,"https://twitter.com/dog_rates/status/684241637099323392/photo/1,https://twitter.com/dog_rates/status/684241637099323392/photo/1,https://twitter.com/dog_rates/status/684241637099323392/photo/1",12,10,Obi,None,None,None,None
1637,684195085588783105,2016-01-05,This is Tino. He really likes corndogs. 9/10 ,https://twitter.com/dog_rates/status/684195085588783105/photo/1,9,10,Tino,None,None,None,None
1639,684177701129875456,2016-01-05,This is Kulet. She's very proud of the flower she picked. Loves it dearly. 10/10 now I want a flower ,https://twitter.com/dog_rates/status/684177701129875456/photo/1,10,10,Kulet,None,None,None,None
1640,684147889187209216,2016-01-04,This is Sweets the English Bulldog. Waves back to other bikers. 12/10 just a fantastic friendly pupper ,https://vine.co/v/ib2nTOEuuOI,12,10,Sweets,None,None,pupper,None
1642,684097758874210310,2016-01-04,Say hello to Lupe. This is how she sleeps. 10/10 impressive really ,https://twitter.com/dog_rates/status/684097758874210310/photo/1,10,10,Lupe,None,None,None,None
1643,683857920510050305,2016-01-04,Meet Sadie. She fell asleep on the beach and her friends buried her. 10/10 can't trust fellow puppers these days ,https://twitter.com/dog_rates/status/683857920510050305/photo/1,10,10,Sadie,None,None,None,None
1644,683852578183077888,2016-01-04,"Say hello to Tiger. He's a penbroke (little dog pun for ya, no need to applaud I know it was good) 10/10 good dog ",https://twitter.com/dog_rates/status/683852578183077888/photo/1,10,10,Tiger,None,None,None,None
1645,683849932751646720,2016-01-04,This is Jiminy. He's not the brightest dog. Needs to lay off the kibble. 5/10 still petable ,https://twitter.com/dog_rates/status/683849932751646720/photo/1,5,10,Jiminy,None,None,None,None
1648,683773439333797890,2016-01-03,This is Buddy. He's gaining strength. Currently an F4 tornado with wind speeds up to 260mph. Very devastating. 9/10 ,https://twitter.com/dog_rates/status/683773439333797890/photo/1,9,10,Buddy,None,None,None,None
1649,683742671509258241,2016-01-03,Meet Sebastian. He's a womanizer. Romantic af. Always covered in flower petals. Also a poet. 11/10 dreamy as hell ,https://twitter.com/dog_rates/status/683742671509258241/photo/1,11,10,Sebastian,None,None,None,None
1651,683498322573824003,2016-01-03,This is Griffin. He's desperate for both a physical and emotion connection. 11/10 I'd hug the hell out of Griffin ,https://twitter.com/dog_rates/status/683498322573824003/photo/1,11,10,Griffin,None,None,None,None
