,tweet_id,timestamp,text,expanded_urls,rating_numerator,rating_denominator,name,doggo,floofer,pupper,puppo
0,892420643555336193,2017-08-01,This is Phineas. He's a mystical boy. Only ever appears in the hole of a donut. 13/10 ,https://twitter.com/dog_rates/status/892420643555336193/photo/1,13,10,Phineas,None,None,None,None
1,892177421306343426,2017-08-01,"This is Tilly. She's just checking pup on you. Hopes you're doing ok. If not, she's available for pats, snugs, boops, the whole bit. 13/10 ",https://twitter.com/dog_rates/status/892177421306343426/photo/1,13,10,Tilly,None,None,None,None
2,891815181378084864,2017-07-31,This is Archie. He is a rare Norwegian Pouncing Corgo. Lives in the tall grass. You never know when one may strike. 12/10 ,https://twitter.com/dog_rates/status/891815181378084864/photo/1,12,10,Archie,None,None,None,None
3,891689557279858688,2017-07-30,This is Darla. She commenced a snooze mid meal. 13/10 happens to the best of us ,https://twitter.com/dog_rates/status/891689557279858688/photo/1,13,10,Darla,None,None,None,None
4,891327558926688256,2017-07-29,"This is Franklin. He would like you to stop calling him ""cute."" He is a very fierce shark and should be respected as such. 12/10 #BarkWeek ","https://twitter.com/dog_rates/status/891327558926688256/photo/1,https://twitter.com/dog_rates/status/891327558926688256/photo/1",12,10,Franklin,None,None,None,None
6,890971913173991426,2017-07-28,"Meet Jax. He enjoys ice cream so much he gets nervous around it. 13/10 help Jax enjoy more things by clicking below

 ","https://gofundme.com/ydvmve-surgery-for-jax,https://twitter.com/dog_rates/status/890971913173991426/photo/1",13,10,Jax,None,None,None,None
8,890609185150312448,2017-07-27,This is Zoey. She doesn't want to be one of the scary sharks. Just wants to be a snuggly pettable boatpet. 13/10 #BarkWeek ,https://twitter.com/dog_rates/status/890609185150312448/photo/1,13,10,Zoey,None,None,None,None
9,890240255349198849,2017-07-26,This is Cassie. She is a college pup. Studying international doggo communication and stick theory. 14/10 so elegant much sophisticate ,https://twitter.com/dog_rates/status/890240255349198849/photo/1,14,10,Cassie,doggo,None,None,None
10,890006608113172480,2017-07-26,This is Koda. He is a South Australian deckshark. Deceptively deadly. Frighteningly majestic. 13/10 would risk a petting #BarkWeek ,"https://twitter.com/dog_rates/status/890006608113172480/photo/1,https://twitter.com/dog_rates/status/890006608113172480/photo/1",13,10,Koda,None,None,None,None
11,889880896479866881,2017-07-25,This is Bruno. He is a service shark. Only gets out of the water to assist you. 13/10 terrifyingly good boy ,https://twitter.com/dog_rates/status/889880896479866881/photo/1,13,10,Bruno,None,None,None,None
13,889638837579907072,2017-07-25,This is Ted. He does his best. Sometimes that's not enough. But it's ok. 12/10 would assist ,"https://twitter.com/dog_rates/status/889638837579907072/photo/1,https://twitter.com/dog_rates/status/889638837579907072/photo/1",12,10,Ted,None,None,None,None
14,889531135344209921,2017-07-24,This is Stuart. He's sporting his favorite fanny pack. Secretly filled with bones only. 13/10 puppared puppo #BarkWeek ,https://twitter.com/dog_rates/status/889531135344209921/photo/1,13,10,Stuart,None,None,None,puppo
15,889278841981685760,2017-07-24,This is Oliver. You're witnessing one of his many brutal attacks. Seems to be playing with his victim. 13/10 fr*ckin frightening #BarkWeek ,https://twitter.com/dog_rates/status/889278841981685760/video/1,13,10,Oliver,None,None,None,None
16,888917238123831296,2017-07-23,This is Jim. He found a fren. Taught him how to sit like the good boys. 12/10 for both ,https://twitter.com/dog_rates/status/888917238123831296/photo/1,12,10,Jim,None,None,None,None
17,888804989199671297,2017-07-22,This is Zeke. He has a new stick. Very proud of it. Would like you to throw it for him without taking it. 13/10 would do my best ,"https://twitter.com/dog_rates/status/888804989199671297/photo/1,https://twitter.com/dog_rates/status/888804989199671297/photo/1",13,10,Zeke,None,None,None,None
18,888554962724278272,2017-07-22,This is Ralphus. He's powering up. Attempting maximum borkdrive. 13/10 inspirational af ,"https://twitter.com/dog_rates/status/888554962724278272/photo/1,https://twitter.com/dog_rates/status/888554962724278272/photo/1,https://twitter.com/dog_rates/status/888554962724278272/photo/1,https://twitter.com/dog_rates/status/888554962724278272/photo/1",13,10,Ralphus,None,None,None,None
19,888202515573088257,2017-07-21,RT @dog_rates: This is Canela. She attempted some fancy porch pics. They were unsuccessful. 13/10 someone help her ,"https://twitter.com/dog_rates/status/887473957103951883/photo/1,https://twitter.com/dog_rates/status/887473957103951883/photo/1,https://twitter.com/dog_rates/status/887473957103951883/photo/1,https://twitter.com/dog_rates/status/887473957103951883/photo/1",13,10,Canela,None,None,None,None
20,888078434458587136,2017-07-20,This is Gerald. He was just told he didn't get the job he interviewed for. A h*ckin injustice. 12/10 didn't want the job anyway ,"https://twitter.com/dog_rates/status/888078434458587136/photo/1,https://twitter.com/dog_rates/status/888078434458587136/photo/1",12,10,Gerald,None,None,None,None
21,887705289381826560,2017-07-19,This is Jeffrey. He has a monopoly on the pool noodles. Currently running a 'boop for two' midweek sale. 13/10 h*ckin strategic ,https://twitter.com/dog_rates/status/887705289381826560/photo/1,13,10,Jeffrey,None,None,None,None
23,887473957103951883,2017-07-19,This is Canela. She attempted some fancy porch pics. They were unsuccessful. 13/10 someone help her ,"https://twitter.com/dog_rates/status/887473957103951883/photo/1,https://twitter.com/dog_rates/status/887473957103951883/photo/1",13,10,Canela,None,None,None,None
26,886983233522544640,2017-07-17,This is Maya. She's very shy. Rarely leaves her cup. 13/10 would find her an environment to thrive in ,"https://twitter.com/dog_rates/status/886983233522544640/photo/1,https://twitter.com/dog_rates/status/886983233522544640/photo/1",13,10,Maya,None,None,None,None
27,886736880519319552,2017-07-16,"This is Mingus. He's a wonderful father to his smol pup. Confirmed 13/10, but he needs your help

 ","https://www.gofundme.com/mingusneedsus,https://twitter.com/dog_rates/status/886736880519319552/photo/1,https://twitter.com/dog_rates/status/886736880519319552/photo/1",13,10,Mingus,None,None,None,None
28,886680336477933568,2017-07-16,This is Derek. He's late for a dog meeting. 13/10 pet...al to the metal ,https://twitter.com/dog_rates/status/886680336477933568/photo/1,13,10,Derek,None,None,None,None
29,886366144734445568,2017-07-15,This is Roscoe. Another pupper fallen victim to spontaneous tongue ejections. Get the BlepiPen immediate. 12/10 deep breaths Roscoe ,"https://twitter.com/dog_rates/status/886366144734445568/photo/1,https://twitter.com/dog_rates/status/886366144734445568/photo/1",12,10,Roscoe,None,None,pupper,None
31,886258384151887873,2017-07-15,This is Waffles. His doggles are pupside down. Unsure how to fix. 13/10 someone assist Waffles ,https://twitter.com/dog_rates/status/886258384151887873/photo/1,13,10,Waffles,None,None,None,None
33,885984800019947520,2017-07-14,Viewer discretion advised. This is Jimbo. He will rip ur finger right h*ckin off. Other dog clearly an accessory. 12/10 pls pet with caution ,https://twitter.com/dog_rates/status/885984800019947520/photo/1,12,10,Jimbo,None,None,None,None
34,885528943205470208,2017-07-13,This is Maisey. She fell asleep mid-excavation. Happens to the best of us. 13/10 would pat noggin approvingly ,https://twitter.com/dog_rates/status/885528943205470208/photo/1,13,10,Maisey,None,None,None,None
36,885311592912609280,2017-07-13,RT @dog_rates: This is Lilly. She just parallel barked. Kindly requests a reward now. 13/10 would pet so well ,"https://twitter.com/dog_rates/status/830583320585068544/photo/1,https://twitter.com/dog_rates/status/830583320585068544/photo/1,https://twitter.com/dog_rates/status/830583320585068544/photo/1,https://twitter.com/dog_rates/status/830583320585068544/photo/1",13,10,Lilly,None,None,None,None
38,884925521741709313,2017-07-12,"This is Earl. He found a hat. Nervous about what you think of it. 12/10 it's delightful, Earl ",https://twitter.com/dog_rates/status/884925521741709313/photo/1,12,10,Earl,None,None,None,None
39,884876753390489601,2017-07-11,This is Lola. It's her first time outside. Must test the earth and taste the atmosphere. 13/10 you're doing great Lola ,"https://twitter.com/dog_rates/status/884876753390489601/photo/1,https://twitter.com/dog_rates/status/884876753390489601/photo/1,https://twitter.com/dog_rates/status/884876753390489601/photo/1,https://twitter.com/dog_rates/status/884876753390489601/photo/1",13,10,Lola,None,None,None,None
40,884562892145688576,2017-07-11,This is Kevin. He's just so happy. 13/10 what is your secret Kevin ,https://twitter.com/dog_rates/status/884562892145688576/photo/1,13,10,Kevin,None,None,None,None
43,884162670584377345,2017-07-09,Meet Yogi. He doesn't have any important dog meetings today he just enjoys looking his best at all times. 12/10 for dangerously dapper doggo ,https://twitter.com/dog_rates/status/884162670584377345/photo/1,12,10,Yogi,doggo,None,None,None
44,883838122936631299,2017-07-09,This is Noah. He can't believe someone made this mess. Got the vacuum out for you though. Offered to help clean pup. 12/10 super good boy ,https://twitter.com/dog_rates/status/883838122936631299/photo/1,12,10,Noah,None,None,None,None
45,883482846933004288,2017-07-08,"This is Bella. She hopes her smile made you smile. If not, she is also offering you her favorite monkey. 13.5/10 ","https://twitter.com/dog_rates/status/883482846933004288/photo/1,https://twitter.com/dog_rates/status/883482846933004288/photo/1",5,10,Bella,None,None,None,None
46,883360690899218434,2017-07-07,Meet Grizzwald. He may be the floofiest floofer I ever did see. Lost eyes saving a schoolbus from a volcano erpuption. 13/10 heroic as h*ck ,https://twitter.com/dog_rates/status/883360690899218434/photo/1,13,10,Grizzwald,None,floofer,None,None
48,882992080364220416,2017-07-06,This is Rusty. He wasn't ready for the first pic. Clearly puppared for the second. 13/10 confirmed great boy ,"https://twitter.com/dog_rates/status/882992080364220416/photo/1,https://twitter.com/dog_rates/status/882992080364220416/photo/1",13,10,Rusty,None,None,None,None
49,882762694511734784,2017-07-06,This is Gus. He's quite the cheeky pupper. Already perfected the disinterested wink. 12/10 would let steal my girl ,https://twitter.com/dog_rates/status/882762694511734784/photo/1,12,10,Gus,None,None,pupper,None
50,882627270321602560,2017-07-05,This is Stanley. He has his first swim lesson today. Doggle straps adjusted. Ready to go. 13/10 Phelps is nervous (IG: stanleythe_corgi) ,https://twitter.com/dog_rates/status/882627270321602560/photo/1,13,10,Stanley,None,None,None,None
51,882268110199369728,2017-07-04,This is Alfy. You're witnessing his first watermelon experience. I think it was a success. 13/10 happy 4th Alfy 🇺🇸 ,"https://twitter.com/dog_rates/status/882268110199369728/photo/1,https://twitter.com/dog_rates/status/882268110199369728/photo/1,https://twitter.com/dog_rates/status/882268110199369728/photo/1",13,10,Alfy,None,None,None,None
52,882045870035918850,2017-07-04,"This is Koko. Her owner, inspired by Barney, recently built a cart for her to use during walks if she got tired. 13/10 rest easy Koko ","https://twitter.com/dog_rates/status/882045870035918850/photo/1,https://twitter.com/dog_rates/status/882045870035918850/photo/1,https://twitter.com/dog_rates/status/882045870035918850/photo/1,https://twitter.com/dog_rates/status/882045870035918850/photo/1",13,10,Koko,None,None,None,None
53,881906580714921986,2017-07-03,This is Rey. He's a Benebop Cumberfloof. 12/10 dangerously pettable ,https://twitter.com/dog_rates/status/881906580714921986/photo/1,12,10,Rey,None,None,None,None
54,881666595344535552,2017-07-03,This is Gary. He couldn't miss this puppertunity for a selfie. Flawless focusing skills. 13/10 would boop intensely ,https://twitter.com/dog_rates/status/881666595344535552/photo/1,13,10,Gary,None,None,None,None
57,881268444196462592,2017-07-01,Meet Elliot. He's a Canadian Forrest Pup. Unusual number of antlers for a dog. Sneaky tongue slip to celebrate #Canada150. 12/10 would pet ,https://twitter.com/dog_rates/status/881268444196462592/photo/1,12,10,Elliot,None,None,None,None
58,880935762899988482,2017-06-30,This is Louis. He's crossing. It's a big deal. 13/10 h*ckin breathtaking ,https://twitter.com/dog_rates/status/880935762899988482/photo/1,13,10,Louis,None,None,None,None
60,880465832366813184,2017-06-29,This is Bella. She had her first beach experience this morning. Complete success. 12/10 would perform a sandy boop ,"https://twitter.com/dog_rates/status/880465832366813184/photo/1,https://twitter.com/dog_rates/status/880465832366813184/photo/1,https://twitter.com/dog_rates/status/880465832366813184/photo/1,https://twitter.com/dog_rates/status/880465832366813184/photo/1",12,10,Bella,None,None,None,None
61,880221127280381952,2017-06-29,Meet Jesse. He's a Fetty Woof. His tongue ejects without warning. A true bleptomaniac. 12/10 would snug well ,"https://twitter.com/dog_rates/status/880221127280381952/photo/1,https://twitter.com/dog_rates/status/880221127280381952/photo/1",12,10,Jesse,None,None,None,None
63,879862464715927552,2017-06-28,This is Romeo. He would like to do an entrance. Requesting your immediate assistance. 13/10 ,"https://twitter.com/dog_rates/status/879862464715927552/photo/1,https://twitter.com/dog_rates/status/879862464715927552/photo/1,https://twitter.com/dog_rates/status/879862464715927552/photo/1",13,10,Romeo,None,None,None,None
65,879492040517615616,2017-06-27,This is Bailey. He thinks you should measure ear length for signs of growth instead. 12/10 ,https://twitter.com/dog_rates/status/879492040517615616/photo/1,12,10,Bailey,None,None,None,None
66,879415818425184262,2017-06-26,This is Duddles. He did an attempt. 13/10 someone help him (vid by Georgia Felici) ,https://twitter.com/dog_rates/status/879415818425184262/video/1,13,10,Duddles,None,None,None,None
67,879376492567855104,2017-06-26,This is Jack AKA Stephen Furry. You're not scoring on him. Unless he slips down the slide. 12/10 would happily get blocked by ,https://twitter.com/dog_rates/status/879376492567855104/photo/1,12,10,Jack,None,None,None,None
68,879130579576475649,2017-06-26,RT @dog_rates: This is Emmy. She was adopted today. Massive round of pupplause for Emmy and her new family. 14/10 for all involved ,"https://twitter.com/dog_rates/status/878057613040115712/photo/1,https://twitter.com/dog_rates/status/878057613040115712/photo/1",14,10,Emmy,None,None,None,None
69,879050749262655488,2017-06-25,This is Steven. He has trouble relating to other dogs. Quite shy. Neck longer than average. Tropical probably. 11/10 would still pet ,https://twitter.com/dog_rates/status/879050749262655488/photo/1,11,10,Steven,None,None,None,None
70,879008229531029506,2017-06-25,This is Beau. That is Beau's balloon. He takes it everywhere. 13/10 would protect at all costs ,https://twitter.com/dog_rates/status/879008229531029506/photo/1,13,10,Beau,None,None,None,None
71,878776093423087618,2017-06-25,This is Snoopy. He's a proud #PrideMonthPuppo. Impeccable handwriting for not having thumbs. 13/10 would love back #PrideMonth ,"https://twitter.com/dog_rates/status/878776093423087618/photo/1,https://twitter.com/dog_rates/status/878776093423087618/photo/1",13,10,Snoopy,None,None,None,puppo
73,878404777348136964,2017-06-24,"RT @dog_rates: Meet Shadow. In an attempt to reach maximum zooming borkdrive, he tore his ACL. Still 13/10 tho. Help him out below

","https://www.gofundme.com/3yd6y1c,https://twitter.com/dog_rates/status/878281511006478336/photo/1",13,10,Shadow,None,None,None,None
74,878316110768087041,2017-06-23,RT @dog_rates: Meet Terrance. He's being yelled at because he stapled the wrong stuff together. 11/10 hang in there Terrance ,https://twitter.com/dog_rates/status/669000397445533696/photo/1,11,10,Terrance,None,None,None,None
75,878281511006478336,2017-06-23,"Meet Shadow. In an attempt to reach maximum zooming borkdrive, he tore his ACL. Still 13/10 tho. Help him out below

 ","https://www.gofundme.com/3yd6y1c,https://twitter.com/dog_rates/status/878281511006478336/photo/1",13,10,Shadow,None,None,None,None
76,878057613040115712,2017-06-23,This is Emmy. She was adopted today. Massive round of pupplause for Emmy and her new family. 14/10 for all involved ,"https://twitter.com/dog_rates/status/878057613040115712/photo/1,https://twitter.com/dog_rates/status/878057613040115712/photo/1",14,10,Emmy,None,None,None,None
77,877736472329191424,2017-06-22,This is Aja. She was just told she's a good dog. Suspicions confirmed. 13/10 would tell again ,"https://twitter.com/dog_rates/status/877736472329191424/photo/1,https://twitter.com/dog_rates/status/877736472329191424/photo/1",13,10,Aja,None,None,None,None
79,877556246731214848,2017-06-21,This is Penny. She's both pupset and fired pup. Not pleased w your barbaric attempts at cleanliness. 12/10 would enjoy more shampoo options ,https://twitter.com/dog_rates/status/877556246731214848/photo/1,12,10,Penny,None,None,None,None
80,877316821321428993,2017-06-21,"Meet Dante. At first he wasn't a fan of his new raincoat, then he saw his reflection. H*ckin handsome. 13/10 for water resistant good boy ","https://twitter.com/dog_rates/status/877316821321428993/photo/1,https://twitter.com/dog_rates/status/877316821321428993/photo/1",13,10,Dante,None,None,None,None
81,877201837425926144,2017-06-20,This is Nelly. He graduated with his dogtorate today. Wants to know if you're proud of him. 12/10 would give congratulatory boop ,"https://twitter.com/dog_rates/status/877201837425926144/photo/1,https://twitter.com/dog_rates/status/877201837425926144/photo/1",12,10,Nelly,None,None,None,None
82,876838120628539392,2017-06-19,This is Ginger. She's having a ruff Monday. Too many pupper things going on. H*ckin exhausting. 12/10 would snug passionately ,"https://twitter.com/dog_rates/status/876838120628539392/photo/1,https://twitter.com/dog_rates/status/876838120628539392/photo/1",12,10,Ginger,None,None,pupper,None
84,876484053909872640,2017-06-18,This is Benedict. He wants to thank you for this delightful urban walk. Hopes you know he loves you. 13/10 super duper good boy ,https://twitter.com/dog_rates/status/876484053909872640/photo/1,13,10,Benedict,None,None,None,None
85,876120275196170240,2017-06-17,"Meet Venti, a seemingly caffeinated puppoccino. She was just informed the weekend would include walks, pats and scritches. 13/10 much excite ",https://twitter.com/dog_rates/status/876120275196170240/photo/1,13,10,Venti,None,None,None,None
86,875747767867523072,2017-06-16,"This is Goose. He's a womanizer. Cheeky as h*ck, but also deep. Tongue slip game on another level. 13/10 will steal your girl ",https://twitter.com/dog_rates/status/875747767867523072/photo/1,13,10,Goose,None,None,None,None
87,875144289856114688,2017-06-15,Meet Nugget and Hank. Nugget took Hank's bone. Hank is wondering if you would please return it to him. Both 13/10 would not intervene ,https://twitter.com/dog_rates/status/875144289856114688/video/1,13,10,Nugget,None,None,None,None
90,874680097055178752,2017-06-13,Meet Cash. He hath acquired a stick. A very good stick tbh. 12/10 would pat head approvingly ,https://twitter.com/dog_rates/status/874680097055178752/photo/1,12,10,Cash,None,None,None,None
91,874434818259525634,2017-06-13,RT @dog_rates: This is Coco. At first I thought she was a cloud but clouds don't bork with such passion. 12/10 would hug softly ,"https://twitter.com/dog_rates/status/866334964761202691/photo/1,https://twitter.com/dog_rates/status/866334964761202691/photo/1",12,10,Coco,None,None,None,None
92,874296783580663808,2017-06-12,This is Jed. He may be the fanciest pupper in the game right now. Knows it too. 13/10 would sign modeling contract ,https://twitter.com/dog_rates/status/874296783580663808/photo/1,13,10,Jed,None,None,pupper,None
94,874012996292530176,2017-06-11,"This is Sebastian. He can't see all the colors of the rainbow, but he can see that this flag makes his human happy. 13/10 #PrideMonth puppo ","https://twitter.com/dog_rates/status/874012996292530176/photo/1,https://twitter.com/dog_rates/status/874012996292530176/photo/1",13,10,Sebastian,None,None,None,puppo
95,873697596434513921,2017-06-11,RT @dog_rates: This is Walter. He won't start hydrotherapy without his favorite floatie. 14/10 keep it pup Walter ,"https://twitter.com/dog_rates/status/868880397819494401/photo/1,https://twitter.com/dog_rates/status/868880397819494401/photo/1",14,10,Walter,None,None,None,None
97,873337748698140672,2017-06-10,"RT @dog_rates: This is Sierra. She's one precious pupper. Absolute 12/10. Been in and out of ICU her whole life. Help Sierra below

","https://www.gofundme.com/help-my-baby-sierra-get-better,https://twitter.com/dog_rates/status/873213775632977920/photo/1,https://twitter.com/dog_rates/status/873213775632977920/photo/1",12,10,Sierra,None,None,pupper,None
98,873213775632977920,2017-06-09,"This is Sierra. She's one precious pupper. Absolute 12/10. Been in and out of ICU her whole life. Help Sierra below

 ","https://www.gofundme.com/help-my-baby-sierra-get-better,https://twitter.com/dog_rates/status/873213775632977920/photo/1,https://twitter.com/dog_rates/status/873213775632977920/photo/1",12,10,Sierra,None,None,pupper,None
102,872620804844003328,2017-06-08,This is Monkey. She's supporting owners everywhere with her fancy #PrideMonth bandana. 13/10 love is love is love... ,https://twitter.com/dog_rates/status/872620804844003328/photo/1,13,10,Monkey,None,None,None,None
104,872261713294495745,2017-06-07,This is Harry. His ears are activated one at a time. Incredibly rare to witness in person. Very special moment here. 13/10 blessed as h*ck ,"https://twitter.com/dog_rates/status/872261713294495745/photo/1,https://twitter.com/dog_rates/status/872261713294495745/photo/1",13,10,Harry,None,None,None,None
105,872122724285648897,2017-06-06,This is Kody. He's a baller. Wishes he was a little bit taller. Double dribbles often. Still 12/10 would happily get dunked on ,"https://twitter.com/dog_rates/status/872122724285648897/photo/1,https://twitter.com/dog_rates/status/872122724285648897/photo/1",12,10,Kody,None,None,None,None
106,871879754684805121,2017-06-06,Say hello to Lassie. She's celebrating #PrideMonth by being a splendid mix of astute and adorable. Proudly supupporting her owner. 13/10 ,"https://twitter.com/dog_rates/status/871879754684805121/photo/1,https://twitter.com/dog_rates/status/871879754684805121/photo/1",13,10,Lassie,None,None,None,None
107,871762521631449091,2017-06-05,This is Rover. As part of pupper protocol he had to at least attempt to eat the plant. Confirmed not tasty. Needs peanut butter. 12/10 ,"https://twitter.com/dog_rates/status/871762521631449091/photo/1,https://twitter.com/dog_rates/status/871762521631449091/photo/1,https://twitter.com/dog_rates/status/871762521631449091/photo/1",12,10,Rover,None,None,pupper,None
108,871515927908634625,2017-06-04,This is Napolean. He's a Raggedy East Nicaraguan Zoom Zoom. Runs on one leg. Built for deception. No eyes. Good with kids. 12/10 great doggo ,"https://twitter.com/dog_rates/status/871515927908634625/photo/1,https://twitter.com/dog_rates/status/871515927908634625/photo/1",12,10,Napolean,doggo,None,None,None
109,871166179821445120,2017-06-04,RT @dog_rates: This is Dawn. She's just checking pup on you. Making sure you're doing okay. 12/10 she's here if you need her ,https://twitter.com/dog_rates/status/841077006473256960/photo/1,12,10,Dawn,None,None,None,None
111,871032628920680449,2017-06-03,"This is Boomer. He's doing an advanced water takeoff. The opposite of Sully. Ears for control, mlem for style. 13/10 simply breathtaking ",https://twitter.com/dog_rates/status/871032628920680449/photo/1,13,10,Boomer,None,None,None,None
114,870656317836468226,2017-06-02,"This is Cody. He zoomed too aggressively and tore his ACL. Happens to the best of us. Still 13/10

Help Cody here:  ","https://www.gofundme.com/help-fix-codys-torn-acl,https://twitter.com/dog_rates/status/870656317836468226/photo/1,https://twitter.com/dog_rates/status/870656317836468226/photo/1,https://twitter.com/dog_rates/status/870656317836468226/photo/1,https://twitter.com/dog_rates/status/870656317836468226/photo/1",13,10,Cody,None,None,None,None
115,870374049280663552,2017-06-01,This is Zoey. She really likes the planet. Would hate to see willful ignorance and the denial of fairly elemental science destroy it. 13/10 ,https://twitter.com/dog_rates/status/870374049280663552/photo/1,13,10,Zoey,None,None,None,None
116,870308999962521604,2017-06-01,"This is Rumble, but he's not ready to. Would rather fall asleep in his bath bucket. 13/10 would attempt a boop without waking ","https://twitter.com/dog_rates/status/870308999962521604/photo/1,https://twitter.com/dog_rates/status/870308999962521604/photo/1",13,10,Rumble,None,None,None,None
117,870063196459192321,2017-05-31,Meet Clifford. He's quite large. Also red. Good w kids. Somehow never steps on them. Massive poops very inconvenient. Still 14/10 would ride ,"https://twitter.com/dog_rates/status/870063196459192321/photo/1,https://twitter.com/dog_rates/status/870063196459192321/photo/1",14,10,Clifford,None,None,None,None
119,869772420881756160,2017-05-31,"This is Dewey (pronounced ""covfefe""). He's having a good walk. Arguably the best walk. 13/10 would snug softly ",https://twitter.com/dog_rates/status/869772420881756160/photo/1,13,10,Dewey,None,None,None,None
