,tweet_id,timestamp,text,expanded_urls,rating_numerator,rating_denominator,name,doggo,floofer,pupper,puppo
476,816014286006976512,2017-01-02,RT @dog_rates: This is Larry. He has no self control. Tongue still nifty af tho 11/10 ,"https://twitter.com/dog_rates/status/732005617171337216/photo/1,https://twitter.com/dog_rates/status/732005617171337216/photo/1,https://twitter.com/dog_rates/status/732005617171337216/photo/1,https://twitter.com/dog_rates/status/732005617171337216/photo/1",11,10,Larry,None,None,None,None
477,815990720817401858,2017-01-02,"Meet Jack. He's one of the rare doggos that doesn't mind baths. 11/10 click the link to see how you can help Jack!

 ","https://www.gofundme.com/surgeryforjacktheminpin,https://twitter.com/dog_rates/status/815990720817401858/photo/1",11,10,Jack,None,None,None,None
479,815745968457060357,2017-01-02,RT @dog_rates: Say hello to Levi. He's a Madagascan Butterbop. One of the more docile Butterbops I've seen. 12/10 would give all the pets h…,"https://twitter.com/dog_rates/status/791406955684368384/photo/1,https://twitter.com/dog_rates/status/791406955684368384/photo/1,https://twitter.com/dog_rates/status/791406955684368384/photo/1,https://twitter.com/dog_rates/status/791406955684368384/photo/1",12,10,Levi,None,None,None,None
480,815736392542261248,2017-01-02,This is Akumi. It's his birthday. He received many lickable gifts. 11/10 happy h*ckin birthday ,"https://twitter.com/dog_rates/status/815736392542261248/photo/1,https://twitter.com/dog_rates/status/815736392542261248/photo/1,https://twitter.com/dog_rates/status/815736392542261248/photo/1,https://twitter.com/dog_rates/status/815736392542261248/photo/1",11,10,Akumi,None,None,None,None
481,815639385530101762,2017-01-01,This is Titan. His nose is quite chilly. Requests to return to the indoors. 12/10 would boop to warm ,https://twitter.com/dog_rates/status/815639385530101762/photo/1,12,10,Titan,None,None,None,None
483,814986499976527872,2016-12-31,This is Cooper. Someone attacked him with a sharpie. Poor pupper. 11/10 nifty tongue slip tho ,https://twitter.com/dog_rates/status/814986499976527872/photo/1,11,10,Cooper,None,None,pupper,None
484,814638523311648768,2016-12-30,This is Olivia. She's a passionate advocate of candid selfies. 12/10 would boop shnoop ,"https://twitter.com/dog_rates/status/814638523311648768/photo/1,https://twitter.com/dog_rates/status/814638523311648768/photo/1,https://twitter.com/dog_rates/status/814638523311648768/photo/1",12,10,Olivia,None,None,None,None
485,814578408554463233,2016-12-29,RT @dog_rates: Meet Beau &amp; Wilbur. Wilbur stole Beau's bed from him. Wilbur now has so much room for activities. 9/10 for both pups ,https://twitter.com/dog_rates/status/698195409219559425/photo/1,9,10,Beau,None,None,None,None
486,814530161257443328,2016-12-29,This is Alf. Someone just rubbed a balloon on his head. He's only a little pupset about it. 12/10 would pet well ,https://twitter.com/dog_rates/status/814530161257443328/photo/1,12,10,Alf,None,None,None,None
487,814153002265309185,2016-12-28,This is Oshie. He's ready to party. Bought that case himself. 12/10 someone tell Oshie it's Wednesday morning ,https://twitter.com/dog_rates/status/814153002265309185/photo/1,12,10,Oshie,None,None,None,None
488,813944609378369540,2016-12-28,RT @dog_rates: This is Bruce. He never backs down from a challenge. 11/10 you got this Bruce ,"https://twitter.com/dog_rates/status/790277117346975746/photo/1,https://twitter.com/dog_rates/status/790277117346975746/photo/1",11,10,Bruce,None,None,None,None
489,813910438903693312,2016-12-28,This is Chubbs. He dug a hole and now he's stuck in it. Dang h*ckin doggo. 11/10 would assist ,https://twitter.com/dog_rates/status/813910438903693312/photo/1,11,10,Chubbs,doggo,None,None,None
490,813812741911748608,2016-12-27,"Meet Gary, Carrie Fisher's dog. Idk what I can say about Gary that reflects the inspirational awesomeness that was Carrie Fisher. 14/10 RIP ","https://twitter.com/dog_rates/status/813812741911748608/photo/1,https://twitter.com/dog_rates/status/813812741911748608/photo/1,https://twitter.com/dog_rates/status/813812741911748608/photo/1",14,10,Gary,None,None,None,None
491,813800681631023104,2016-12-27,This is Sky. She's learning how to roll her R's. 12/10 cultured af ,https://twitter.com/dog_rates/status/813800681631023104/photo/1,12,10,Sky,None,None,None,None
492,813217897535406080,2016-12-26,Here is Atlas. He went all out this year. 13/10 downright magical af ,"https://twitter.com/dog_rates/status/813217897535406080/photo/1,https://twitter.com/dog_rates/status/813217897535406080/photo/1,https://twitter.com/dog_rates/status/813217897535406080/photo/1,https://twitter.com/dog_rates/status/813217897535406080/photo/1",13,10,Atlas,None,None,None,None
495,813172488309972993,2016-12-26,This is Eleanor. She winks like she knows many things that you don't. 12/10 ,https://twitter.com/dog_rates/status/813172488309972993/photo/1,12,10,Eleanor,None,None,None,None
496,813157409116065792,2016-12-25,This is Layla. It is her first Christmas. She got to be one of the presents. 12/10 I wish my presents would bark ,"https://twitter.com/dog_rates/status/813157409116065792/photo/1,https://twitter.com/dog_rates/status/813157409116065792/photo/1,https://twitter.com/dog_rates/status/813157409116065792/photo/1,https://twitter.com/dog_rates/status/813157409116065792/photo/1",12,10,Layla,None,None,None,None
500,813112105746448384,2016-12-25,Meet Toby. He's pupset because his hat isn't big enough. Christmas is ruined. 12/10 it'll be ok Toby ,https://twitter.com/dog_rates/status/813112105746448384/photo/1,12,10,Toby,None,None,None,None
501,813096984823349248,2016-12-25,This is Rocky. He got triple-doggo-dared. Stuck af. 11/10 someone help him ,https://twitter.com/dog_rates/status/813096984823349248/photo/1,11,10,Rocky,doggo,None,None,None
502,813081950185472002,2016-12-25,This is Baron. He's officially festive as h*ck. Thinks it's just a fancy scarf. 11/10 would pat head approvingly ,"https://twitter.com/dog_rates/status/813081950185472002/photo/1,https://twitter.com/dog_rates/status/813081950185472002/photo/1",11,10,Baron,None,None,None,None
503,813066809284972545,2016-12-25,This is Tyr. He is disgusted by holiday traffic. Just trying to get to Christmas brunch on time. 12/10 hurry up pup ,https://twitter.com/dog_rates/status/813066809284972545/photo/1,12,10,Tyr,None,None,None,None
504,813051746834595840,2016-12-25,This is Bauer. He had nothing to do with the cookies that disappeared. 13/10 very good boy ,https://twitter.com/dog_rates/status/813051746834595840/photo/1,13,10,Bauer,None,None,None,None
505,812781120811126785,2016-12-24,This is Swagger. He's the Cleveland Browns ambassador. Hype as h*ck after that first win today. 10/10 ,"https://twitter.com/dog_rates/status/812781120811126785/photo/1,https://twitter.com/dog_rates/status/812781120811126785/photo/1,https://twitter.com/dog_rates/status/812781120811126785/photo/1",10,10,Swagger,None,None,None,None
506,812747805718642688,2016-12-24,"RT @dog_rates: Meet Sammy. At first I was like ""that's a snowflake. we only rate dogs,"" but he would've melted by now, so 10/10 ",https://twitter.com/dog_rates/status/680055455951884288/photo/1,10,10,Sammy,None,None,None,None
507,812709060537683968,2016-12-24,This is Brandi and Harley. They are practicing their caroling for later. Both 12/10 festive af ,https://twitter.com/dog_rates/status/812709060537683968/photo/1,12,10,Brandi,None,None,None,None
509,812466873996607488,2016-12-24,This is Mary. She's desperately trying to recreate her Coachella experience.   12/10 downright h*ckin adorable ,https://twitter.com/dog_rates/status/812466873996607488/photo/1,12,10,Mary,None,None,None,None
510,812372279581671427,2016-12-23,This is Moe. He's a fetty woof. Got a cardboard cutout of himself for Christmas. 13/10 inspirational af ,"https://twitter.com/dog_rates/status/812372279581671427/photo/1,https://twitter.com/dog_rates/status/812372279581671427/photo/1",13,10,Moe,None,None,None,None
511,811985624773361665,2016-12-22,Say hello to Ted. He accidentally opened the front facing camera. 11/10 h*ckin unpupared ,https://twitter.com/dog_rates/status/811985624773361665/photo/1,11,10,Ted,None,None,None,None
512,811744202451197953,2016-12-22,This is Halo. She likes watermelon. 13/10 ,https://twitter.com/dog_rates/status/811744202451197953/photo/1,13,10,Halo,None,None,None,None
514,811627233043480576,2016-12-21,This is Augie. He's a savage. Doesn't give a h*ck about your garden. Still 10/10 would forgive then pet ,https://twitter.com/dog_rates/status/811627233043480576/photo/1,10,10,Augie,None,None,None,None
515,811386762094317568,2016-12-21,This is Craig. That's actually a normal sized fence he's stuck on. H*ckin massive pupper. 11/10 someone help him ,https://twitter.com/dog_rates/status/811386762094317568/photo/1,11,10,Craig,None,None,pupper,None
516,810984652412424192,2016-12-19,"Meet Sam. She smiles 24/7 &amp; secretly aspires to be a reindeer. 
Keep Sam smiling by clicking and sharing this link:
 ","https://www.gofundme.com/sams-smile,https://twitter.com/dog_rates/status/810984652412424192/photo/1",24,7,Sam,None,None,None,None
517,810896069567610880,2016-12-19,"This is Hunter. He just found out he needs braces. Requesting an orthodogtist stat. 11/10 you're fine Hunter, everything's fine ","https://twitter.com/dog_rates/status/810896069567610880/photo/1,https://twitter.com/dog_rates/status/810896069567610880/photo/1,https://twitter.com/dog_rates/status/810896069567610880/photo/1",11,10,Hunter,None,None,None,None
518,810657578271330305,2016-12-19,This is Pavlov. His floatation device has failed him. He's quite pupset about it. 11/10 would rescue ,https://twitter.com/dog_rates/status/810657578271330305/photo/1,11,10,Pavlov,None,None,None,None
519,810284430598270976,2016-12-18,This is Phil. He's a father. A very good father too. 13/10 everybody loves Phil ,"https://twitter.com/dog_rates/status/810284430598270976/photo/1,https://twitter.com/dog_rates/status/810284430598270976/photo/1",13,10,Phil,None,None,None,None
520,810254108431155201,2016-12-17,"This is Gus. He likes to be close to you, which is good because you want to be close to Gus. 12/10 would boop then pet ",https://twitter.com/dog_rates/status/810254108431155201/photo/1,12,10,Gus,None,None,None,None
522,809808892968534016,2016-12-16,RT @dog_rates: This is Maximus. His face is stuck like that. Tragic really. Great tongue tho. 12/10 would pet firmly ,"https://twitter.com/dog_rates/status/793962221541933056/photo/1,https://twitter.com/dog_rates/status/793962221541933056/photo/1,https://twitter.com/dog_rates/status/793962221541933056/photo/1,https://twitter.com/dog_rates/status/793962221541933056/photo/1",12,10,Maximus,None,None,None,None
524,809220051211603969,2016-12-15,This is Kyro. He's a Stratocumulus Flop. Tongue ejects at random. Serious h*ckin condition. Still 12/10 would pet passionately ,"https://twitter.com/dog_rates/status/809220051211603969/photo/1,https://twitter.com/dog_rates/status/809220051211603969/photo/1",12,10,Kyro,None,None,None,None
525,809084759137812480,2016-12-14,"This is Wallace. You said you brushed your teeth but he checked your toothbrush and it was bone dry. 11/10 not pupset, just disappointed ",https://twitter.com/dog_rates/status/809084759137812480/photo/1,11,10,Wallace,None,None,None,None
526,808838249661788160,2016-12-14,This is Ito. He'll be your uber driver tonight. Currently adjusting the mirrors. 13/10 incredibly h*ckin responsible ,https://twitter.com/dog_rates/status/808838249661788160/photo/1,13,10,Ito,None,None,None,None
528,808501579447930884,2016-12-13,This is Koda. He dug a hole and then sat in it because why not. Unamused by the bath that followed. 12/10 ,"https://twitter.com/dog_rates/status/808501579447930884/photo/1,https://twitter.com/dog_rates/status/808501579447930884/photo/1",12,10,Koda,None,None,None,None
529,808344865868283904,2016-12-12,This is Seamus. He's very bad at entering pools. Still a very good boy tho 11/10 ,https://vine.co/v/5QWd3LZqXxd,11,10,Seamus,None,None,None,None
530,808134635716833280,2016-12-12,RT @dog_rates: This is Milo. I would do terrible things for Milo. 13/10 ,"https://twitter.com/dog_rates/status/801167903437357056/photo/1,https://twitter.com/dog_rates/status/801167903437357056/photo/1",13,10,Milo,None,None,None,None
532,808001312164028416,2016-12-11,This is Cooper. He likes to stick his tongue out at you and then laugh about it. 12/10 quite the jokester ,"https://twitter.com/dog_rates/status/808001312164028416/photo/1,https://twitter.com/dog_rates/status/808001312164028416/photo/1",12,10,Cooper,None,None,None,None
533,807621403335917568,2016-12-10,This is Ollie Vue. He was a 3 legged pupper on a mission to overcome everything. This is very hard to write. 14/10 we will miss you Ollie ,"https://twitter.com/dog_rates/status/807621403335917568/photo/1,https://twitter.com/dog_rates/status/807621403335917568/photo/1,https://twitter.com/dog_rates/status/807621403335917568/photo/1,https://twitter.com/dog_rates/status/807621403335917568/photo/1",14,10,Ollie,None,None,pupper,None
534,807106840509214720,2016-12-09,This is Stephan. He just wants to help. 13/10 such a good boy ,https://twitter.com/dog_rates/status/807106840509214720/video/1,13,10,Stephan,None,None,None,None
535,807059379405148160,2016-12-09,RT @dog_rates: This is Cali. She arrived preassembled. Convenient af. 12/10 appears to be rather h*ckin pettable ,"https://twitter.com/dog_rates/status/782969140009107456/photo/1,https://twitter.com/dog_rates/status/782969140009107456/photo/1,https://twitter.com/dog_rates/status/782969140009107456/photo/1,https://twitter.com/dog_rates/status/782969140009107456/photo/1",12,10,Cali,None,None,None,None
536,807010152071229440,2016-12-08,This is Lennon. He's a Boopershnoop Pupperdoop. Quite rare. Exceptionally pettable. 12/10 would definitely boop that shnoop ,https://twitter.com/dog_rates/status/807010152071229440/photo/1,12,10,Lennon,None,None,None,None
540,806542213899489280,2016-12-07,This is Waffles. He's concerned that the dandruff shampoo he just bought is faulty. 11/10 tragic af ,https://twitter.com/dog_rates/status/806542213899489280/photo/1,11,10,Waffles,None,None,None,None
541,806242860592926720,2016-12-06,RT @dog_rates: This is Dave. He's currently in a predicament. Doesn't seem to mind tho. 12/10 someone assist Dave ,"https://twitter.com/dog_rates/status/783334639985389568/photo/1,https://twitter.com/dog_rates/status/783334639985389568/photo/1,https://twitter.com/dog_rates/status/783334639985389568/photo/1,https://twitter.com/dog_rates/status/783334639985389568/photo/1,https://twitter.com/dog_rates/status/783334639985389568/photo/1,https://twitter.com/dog_rates/status/783334639985389568/photo/1",12,10,Dave,None,None,None,None
543,805958939288408065,2016-12-06,"RT @dog_rates: This is Penny. She fought a bee and the bee won. 10/10 you're fine Penny, everything's fine ","https://twitter.com/dog_rates/status/782722598790725632/photo/1,https://twitter.com/dog_rates/status/782722598790725632/photo/1",10,10,Penny,None,None,None,None
544,805932879469572096,2016-12-06,This is Major. He put on a tie for his first real walk. Only a little crooked. Can also drool upwards. H*ckin talented. 12/10 ,https://twitter.com/dog_rates/status/805932879469572096/photo/1,12,10,Major,None,None,None,None
545,805826884734976000,2016-12-05,This is Duke. He is not a fan of the pupporazzi. 12/10 ,https://twitter.com/dog_rates/status/805826884734976000/video/1,12,10,Duke,None,None,None,None
546,805823200554876929,2016-12-05,RT @dog_rates: This is Reginald. He's one magical puppo. Aerodynamic af. 12/10 would catch ,"https://vine.co/v/5ghHLBMMdlV,https://vine.co/v/5ghHLBMMdlV",12,10,Reginald,None,None,None,puppo
547,805520635690676224,2016-12-04,This is Zeke the Wonder Dog. He never let that poor man keep his frisbees. One of the Spartans all time greatest receivers. 13/10 RIP Zeke ,"https://twitter.com/dog_rates/status/805520635690676224/photo/1,https://twitter.com/dog_rates/status/805520635690676224/photo/1,https://twitter.com/dog_rates/status/805520635690676224/photo/1,https://twitter.com/dog_rates/status/805520635690676224/photo/1",13,10,Zeke,None,None,None,None
548,805487436403003392,2016-12-04,"Meet Sansa and Gary. They run along the fence together everyday, so the owners installed a window for them. Both 12/10 h*ckin romantic af ","https://twitter.com/dog_rates/status/805487436403003392/photo/1,https://twitter.com/dog_rates/status/805487436403003392/photo/1,https://twitter.com/dog_rates/status/805487436403003392/photo/1,https://twitter.com/dog_rates/status/805487436403003392/photo/1",12,10,Sansa,None,None,None,None
549,805207613751304193,2016-12-04,This is Shooter. He's doing quite the snowy zoom. 12/10 ,https://twitter.com/dog_rates/status/805207613751304193/photo/1,12,10,Shooter,None,None,None,None
550,804738756058218496,2016-12-02,This is Django. He accidentally opened the front facing camera. Did him quite the frighten. 12/10 ,https://twitter.com/dog_rates/status/804738756058218496/photo/1,12,10,Django,None,None,None,None
552,804413760345620481,2016-12-01,RT @dog_rates: This is Rusty. He's going D1 for sure. Insane vertical. 13/10 would draft ,"https://twitter.com/dog_rates/status/784826020293709826/photo/1,https://twitter.com/dog_rates/status/784826020293709826/photo/1",13,10,Rusty,None,None,None,None
553,804026241225523202,2016-11-30,This is Bo. He's going to make me cry. 13/10 please get off the bus for him Carly ,"https://twitter.com/dog_rates/status/804026241225523202/photo/1,https://twitter.com/dog_rates/status/804026241225523202/photo/1,https://twitter.com/dog_rates/status/804026241225523202/photo/1",13,10,Bo,None,None,None,None
554,803773340896923648,2016-11-30,This is Diogi. He fell in the pool as soon as he was brought home. Clumsy puppo. 12/10 would pet until dry ,"https://twitter.com/dog_rates/status/803773340896923648/photo/1,https://twitter.com/dog_rates/status/803773340896923648/photo/1,https://twitter.com/dog_rates/status/803773340896923648/photo/1,https://twitter.com/dog_rates/status/803773340896923648/photo/1",12,10,Diogi,None,None,None,puppo
557,803380650405482500,2016-11-28,Meet Sonny. He's an in-home movie critic. That is his collection. He's very proud of it. 12/10 ,https://twitter.com/dog_rates/status/803380650405482500/photo/1,12,10,Sonny,None,None,None,None
558,803321560782307329,2016-11-28,RT @dog_rates: This is Philbert. His toilet broke and he doesn't know what to do. Trying not to panic. 11/10 furustrated af ,https://twitter.com/dog_rates/status/767754930266464257/photo/1,11,10,Philbert,None,None,None,None
559,803276597545603072,2016-11-28,This is Winston. His selfie game is legendary. Will steal your girl with a single snap. 11/10 handsome as h*ck ,https://twitter.com/dog_rates/status/803276597545603072/photo/1,11,10,Winston,None,None,None,None
560,802952499103731712,2016-11-27,This is Marley. She's having a ruff day. Pretty pupset. 12/10 would assist ,https://twitter.com/dog_rates/status/802952499103731712/photo/1,12,10,Marley,None,None,None,None
562,802600418706604034,2016-11-26,This is Bailey. She has mastered the head tilt. 11/10 rather h*ckin adorable ,https://vine.co/v/5FwUWjYaW0Y,11,10,Bailey,None,None,None,None
563,802572683846291456,2016-11-26,This is Winnie. She's h*ckin ferocious. Dandelion doesn't even see her coming. 12/10 would pet with caution ,https://twitter.com/dog_rates/status/802572683846291456/photo/1,12,10,Winnie,None,None,None,None
564,802323869084381190,2016-11-26,This is Severus. He's here to fix your cable. Looks like he succeeded. Even offered to pupgrade your plan. 13/10 h*ckin helpful ,"https://twitter.com/dog_rates/status/802323869084381190/photo/1,https://twitter.com/dog_rates/status/802323869084381190/photo/1,https://twitter.com/dog_rates/status/802323869084381190/photo/1,https://twitter.com/dog_rates/status/802323869084381190/photo/1",13,10,Severus,None,None,None,None
567,802239329049477120,2016-11-25,This is Loki. He'll do your taxes for you. Can also make room in your budget for all the things you bought today. 12/10 what a puppo ,"https://twitter.com/dog_rates/status/802239329049477120/photo/1,https://twitter.com/dog_rates/status/802239329049477120/photo/1",12,10,Loki,None,None,None,puppo
569,801958328846974976,2016-11-25,This is Ronnie. He hopes you're having a great day. Nifty tongue slip. 12/10 would pat head approvingly ,https://twitter.com/dog_rates/status/801958328846974976/photo/1,12,10,Ronnie,None,None,None,None
571,801538201127157760,2016-11-23,This is Wallace. He'll be your chau-fur this evening. 12/10 eyes on the road Wallace ,https://twitter.com/dog_rates/status/801538201127157760/photo/1,12,10,Wallace,None,None,None,None
573,801167903437357056,2016-11-22,This is Milo. I would do terrible things for Milo. 13/10 ,https://twitter.com/dog_rates/status/801167903437357056/photo/1,13,10,Milo,None,None,None,None
574,801127390143516673,2016-11-22,RT @dog_rates: This is Anakin. He strives to reach his full doggo potential. Born with blurry tail tho. 11/10 would still pet well ,https://twitter.com/dog_rates/status/775733305207554048/photo/1,11,10,Anakin,doggo,None,None,None
575,801115127852503040,2016-11-22,This is Bones. He's being haunted by another doggo of roughly the same size. 12/10 deep breaths pupper everything's fine ,"https://twitter.com/dog_rates/status/801115127852503040/photo/1,https://twitter.com/dog_rates/status/801115127852503040/photo/1",12,10,Bones,doggo,None,pupper,None
578,800751577355128832,2016-11-21,Say hello to Mauve and Murphy. They're rather h*ckin filthy. Preferred nap over bath. Both 12/10 ,"https://twitter.com/dog_rates/status/800751577355128832/photo/1,https://twitter.com/dog_rates/status/800751577355128832/photo/1,https://twitter.com/dog_rates/status/800751577355128832/photo/1",12,10,Mauve,None,None,None,None
579,800513324630806528,2016-11-21,This is Chef. Chef loves everyone and wants everyone to love each other. 11/10 ,https://twitter.com/dog_rates/status/800513324630806528/photo/1,11,10,Chef,None,None,None,None
581,800443802682937345,2016-11-20,RT @dog_rates: This is Sampson. He's about to get hit with a vicious draw 2. Has no idea. 11/10 poor pupper ,"https://twitter.com/dog_rates/status/776113305656188928/photo/1,https://twitter.com/dog_rates/status/776113305656188928/photo/1",11,10,Sampson,None,None,pupper,None
582,800388270626521089,2016-11-20,This is Doc. He takes time out of every day to worship our plant overlords. 12/10 quite the floofer ,"https://twitter.com/dog_rates/status/800388270626521089/photo/1,https://twitter.com/dog_rates/status/800388270626521089/photo/1,https://twitter.com/dog_rates/status/800388270626521089/photo/1",12,10,Doc,None,floofer,None,None
583,800188575492947969,2016-11-20,RT @dog_rates: This is Bo. He's a Benedoop Cumbersnatch. Seems frustrated with own feet. Portable as hell. 11/10 very solid pupper ,https://twitter.com/dog_rates/status/681694085539872773/photo/1,11,10,Bo,None,None,pupper,None
584,800141422401830912,2016-11-20,This is Peaches. She's the ultimate selfie sidekick. Super sneaky tongue slip appreciated. 13/10 ,"https://twitter.com/dog_rates/status/800141422401830912/photo/1,https://twitter.com/dog_rates/status/800141422401830912/photo/1,https://twitter.com/dog_rates/status/800141422401830912/photo/1",13,10,Peaches,None,None,None,None
586,799774291445383169,2016-11-19,RT @dog_rates: This is Tucker. He would like a hug. 13/10 someone hug him ,"https://twitter.com/dog_rates/status/775085132600442880/photo/1,https://twitter.com/dog_rates/status/775085132600442880/photo/1",13,10,Tucker,None,None,None,None
587,799757965289017345,2016-11-18,This is Sobe. She's a h*ckin happy doggo. Only one leg tho. Must have good balance. 13/10 would smile back ,"https://twitter.com/dog_rates/status/799757965289017345/photo/1,https://twitter.com/dog_rates/status/799757965289017345/photo/1,https://twitter.com/dog_rates/status/799757965289017345/photo/1,https://twitter.com/dog_rates/status/799757965289017345/photo/1",13,10,Sobe,doggo,None,None,None
588,799422933579902976,2016-11-18,This is Longfellow (prolly sophisticated). He's a North Appalachian Oatzenjammer. Concerned about wrinkled feets. 12/10 would hug softly ,https://twitter.com/dog_rates/status/799422933579902976/photo/1,12,10,Longfellow,None,None,None,None
590,799297110730567681,2016-11-17,This is Jeffrey. He's quite the jokester. Takes it too far sometimes. Still 11/10 would pet ,"https://twitter.com/dog_rates/status/799297110730567681/photo/1,https://twitter.com/dog_rates/status/799297110730567681/photo/1",11,10,Jeffrey,None,None,None,None
591,799063482566066176,2016-11-17,This is Mister. He only wears the most fashionable af headwear. 11/10 h*ckin stylish ,"https://twitter.com/dog_rates/status/799063482566066176/photo/1,https://twitter.com/dog_rates/status/799063482566066176/photo/1,https://twitter.com/dog_rates/status/799063482566066176/photo/1,https://twitter.com/dog_rates/status/799063482566066176/photo/1",11,10,Mister,None,None,None,None
592,798933969379225600,2016-11-16,This is Iroh. He's in a predicament. 12/10 someone help him ,"https://twitter.com/dog_rates/status/798933969379225600/photo/1,https://twitter.com/dog_rates/status/798933969379225600/photo/1",12,10,Iroh,None,None,None,None
593,798925684722855936,2016-11-16,This is Shadow. He's a firm believer that they're all good dogs. H*ckin passionate about it too. 11/10 I stand with Shadow ,https://twitter.com/dog_rates/status/798925684722855936/photo/1,11,10,Shadow,None,None,None,None
594,798705661114773508,2016-11-16,"RT @dog_rates: Meet Baloo. He's expecting a fast ground ball, hence the wide stance. Prepared af. 11/10 nothing runs like a pupper ",https://twitter.com/dog_rates/status/740676976021798912/photo/1,11,10,Baloo,None,None,pupper,None
